hook,forcekeyA,forcekeyB,forcekeyC,forcekeyD,forcekeyE,unique_ad_count
Drive your new truck with zero down Drive your dream truck today!,100 accepted 0 down options new f150 and ram trucks near me [at no cost] apply now,find 100 accepted 0 down options new f150 and ram trucks near me [at no cost] apply now,100 accepted 0 down options new f150 and ram trucks near me [at no cost] apply now near you,get 100 accepted 0 down options new f150 and ram trucks near me [at no cost] apply now,apply for 100 accepted 0 down options new f150 and ram trucks near me [at no cost] apply now,2
¡Solo $249 al mes por vivienda para mayores!,best senior living options for $249/mo,senior living options for $249/mo,find senior living options for $249/mo,best senior living options for $249/month,senior living options for $249/month,14
Juvederm treatments at surprisingly low prices Smooth out wrinkles and restore volume — Juvederm treatments are more affordable than ever.,juvéderm clinics near me,find juvéderm clinics near me,see juvéderm clinics near me,must-see juvéderm clinics near me,must see juvéderm clinics near me,3
Get paid to learn — start driving today Get paid while you train!,pickup driver career,find pickup driver career,pickup driver career near you,start pickup driver career,apply for pickup driver career,1
Take back your independence today Regain your freedom with a Medicare-covered mobility scooter — no out-of-pocket costs for those who qualify.,applying for medicare-covered mobility scooters asap - 100 coverage,apply for medicare-covered mobility scooters asap - 100 coverage,find applying for medicare-covered mobility scooters asap - 100 coverage,applying for medicare-covered mobility scooters asap - 100 coverage near you,get applying for medicare-covered mobility scooters asap - 100 coverage,3
Grand Cherokee From $100/Month Don’t miss this: Grand Cherokee SUV deals starting at just $100/month—available now in your area.,$100/month ‐ Grand Cherokee 2024 Suvs Nearby,$100/month Grand Cherokee 2024 Suvs Nearby,$100/month ‐ Grand Cherokee 2024 Suvs Near me,$100/month ‐ Grand Cherokee 2024 Suv Nearby,$100/month ‐ Grand Cherokee 2025 Suvs Nearby,13
Medications Linked to Atrial Fibrillation 💊 New research reveals medications linked to atrial fibrillation—see which drugs could increase your risk.,paroxysmal atrial fibrillation anticoagulation,atrial fibrillation medications,anticoagulation in elderly patients with atrial fibrillation,symptoms of atrial fibrillation in elderly,early detection of atrial fibrillation,2
Talk to a Local Immigration Lawyer 🌎 Need immigration assistance?,Immigration attorneys in Santa Monica,Immigration attorney in California,Find an immigration lawyer,Get an immigration lawyer quickly,Find immigration lawyer in my area,3
Dinero Gratis Para Baños Desbloquea subvenciones secretas para renovar tu elegibilidad de verificación de baño ahora.,bathroom remodel paid by grants [region],bathroom remodel paid by grants ,get bathroom remodel paid by grants ,find bathroom remodel paid by grants ,bathroom remodel paid for by grants ,10
Internet desde $19 ¡Tu código postal califica!,$19.99 Internet Providers in My Zip Code,see $19.99 Internet Providers in My Zip Code,find $19.99 Internet Providers in My Zip Code,$19.99 Internet Provider in My Zip Code,get $19.99 Internet Providers in My Zip Code,9
Instant Rogue Approval Want a Nissan Rogue?,nearby rogue - zero down 100 accepted suvs,find nearby rogue - zero down 100 accepted suvs,get nearby rogue - zero down 100 accepted suvs,see nearby rogue - zero down 100 accepted suvs,nearby rogue - zero down 100 accepted suv,14
Tree Removal for Just $49 – See If You Qualify!,Tree Cutting Service for $49 Near My Zipcode,Tree Cutting Services for $49 Near My Zipcode,Tree Cutting Service Near My Zipcode for $49,Tree Cutting Services Near My Zipcode for $49,Tree Cutting Service for $49 Near Me,29
Ram 2024 por $100/Mes La Dodge Ram 2024 está aquí por solo $100 al mes.,$100/month - Dodge Ram 2024 Nearby,$100/month - Dodge Ram 2024 Near Me,$100/month Dodge Ram 2024 Nearby,See $100/month - Dodge Ram 2024 Nearby,Find $100/month - Dodge Ram 2024 Nearby,2
"$99 Laser Skin Rejuvenation Get fresh, rejuvenated skin with laser treatments.",Laser skin rejuvenation [city],Laser skin rejuvenation in [city],Facial Laser Rejuvenation Treatment,Face Rejuvenation Laser Treatment,Facial Laser Treatment,27
$99 Laser Skin Rejuvenation Rejuvenate Your Skin!,Laser skin rejuvenation [city],Laser skin rejuvenation in [city],Facial Laser Rejuvenation Treatment,Face Rejuvenation Laser Treatment,Facial Laser Treatment,1
"Budget-Friendly 55+ Apartments Revealed Discover hidden affordable apartment options designed for those 55+, with benefits you might not expect.",55 and older apartments near me,see 55 and older apartments near me,find 55 and older apartments near me,55 and older apartment near me,discover 55 and older apartments near me,14
Comidas Gratis a Domicilio para Adultos Mayores 🥗 Los adultos mayores pueden calificar para recibir comidas nutritivas gratis directamente en su puerta—descubre hoy si tú o un ser,home delivered meals for seniors no cost,$0 meal delivery,free home delivered meals for seniors near me,free home delivered meals for seniors,$0 meal delivery in [city],4
Seniors: Get $10/Mo Internet 💸 Internet for $10?,$10 Internet Providers in My Zip Code,find $10 Internet Providers in My Zip Code,see $10 Internet Providers in My Zip Code,$10 Internet Provider in My Zip Code,get $10 Internet Providers in My Zip Code,14
Senior Living From $499/Month 🏡 🏡 Discover 55+ senior living communities starting at just $499/month—affordable comfort without compromise.,$499/mo 55 and Older Apartments Near Me,$499/mo Senior Living,$499/mo 55 and Older Apartments in [city],$499/mo 55 and Older Apartments in [region],$499/mo 55  Apartments,2
{{product.,Laser skin rejuvenation [city],Laser skin rejuvenation in [city],Facial Laser Rejuvenation Treatment,Face Rejuvenation Laser Treatment,Facial Laser Treatment,2
Seniors Under 85 Can Own a GMC Sierra for Less Than $10K!,gmc sierra 1500 clearance sale - see [region] prices,see gmc sierra 1500 clearance sale - see [region] prices,find gmc sierra 1500 clearance sale - see [region] prices,must-see gmc sierra 1500 clearance sale - see [region] prices,must see gmc sierra 1500 clearance sale - see [region]prices,1
Senior Living for $249!,best senior living options for $249/mo,senior living options for $249/mo,find senior living options for $249/mo,best senior living options for $249/month,senior living options for $249/month,19
Tree Cutting From $9 Near You 🌳 Tree removal starting at just $9—see if your ZIP qualifies today.,$9 tree cutting service (near my zipcode),find $9 tree cutting service (near my zipcode),discover $9 tree cutting service (near my zipcode),$9 tree cutting service near me,$9 tree cutting service nearby,15
{{product.,$9 tree cutting service (near my zipcode),find $9 tree cutting service (near my zipcode),discover $9 tree cutting service (near my zipcode),$9 tree cutting service near me,$9 tree cutting service nearby,5
Obtén dinero gratis para comprar una casa ¿Necesitas una casa?,Help me get a house,Assist me in getting a house,Help me get a house in {city},Help me get a house in 2025,Help me get a house in {region} by 2025,4
Seniors: Rent Starts Low Senior apartments for just $499/month?,499/mo 55 and older apartments near me [state],499/mo 55 and older apartments nearby,499/mo 55 and older apartments near me,see 499/mo 55 and older apartments,find 499/mo 55 and older apartments,10
"Laser Skin Rejuvenation Without Breaking Bank Get fresh, rejuvenated skin with laser treatments.",Laser skin rejuvenation [city],Laser skin rejuvenation in [city],Facial Laser Rejuvenation Treatment,Face Rejuvenation Laser Treatment,Facial Laser Treatment,2