hook,forcekeys,unique_ad_count,run_dir
Compra tu Casa con Dinero Gratis: Descubre Cómo ¿Quieres comprar una casa pero no tienes dinero?,Help me get a house | Assist me in getting a house | Help me get a house in {city} | Help me get a house in 2025 | Help me get a house in {region} by 2025,8,backend/runs/2025-10-20_593450633843471/
$249/Month Senior Living!,Senior Living Options for $249/month | see Senior Living Options for $249/month | find Senior Living Options for $249/month | must see Senior Living Options for $249/month | must-see Senior Living Options for $249/month,25,backend/runs/2025-10-20_593450633843471/
Tree Removal for Just $49 – See If You Qualify!,tree cutting service for $49 near my zipcode | tree cutting services for $49 near my zipcode | tree cutting service near my zipcode for $49 | tree cutting services near my zipcode for $49 | tree cutting service for $49 near me,7,backend/runs/2025-10-20_593450633843471/
Botox completo solo $119 Luce radiante con Botox completo por solo $119—la belleza gana aquí everydaysolutions.,get $119 botox doctor near me full botox | $119 botox doctor near me full botox | get $119 botox doctor nearby full botox | Get $119 Botox Doctor Near [city] Full Botox | Get $119 Botox Doctor Near [region] Full Botox,12,backend/runs/2025-10-20_593450633843471/
Botox completo solo $119 Luce radiante con Botox completo por solo $119—la belleza gana aquí everydaysolutions.,Get $119 Botox Doctor Near Me Full Botox | $119 Botox Doctor Near Me Full Botox | Get $119 Botox Doctor Nearby Full Botox | Get $119 Botox Doctor Near [city] Full Botox | Get $119 Botox Doctor Near [region] Full Botox,11,backend/runs/2025-10-20_593450633843471/
Teléfonos Gratis para Adultos Mayores Celulares económicos y fáciles de usar esperan por los adultos mayores.,discounted senior phone plans | get discounted senior phone plans | discounted phones for seniors 60 and older | discounted phones for seniors 60 | best discounted senior phone plans,31,backend/runs/2025-10-20_593450633843471/
Comunidades para adultos mayores que están dando de qué hablar en 2025 ¿Estás pensando en mudarte?,55 plus apartments | 55 and older apartments | new 55 plus communities | 55 plus new construction | homes for 55 and older,4,backend/runs/2025-10-20_593450633843471/
🛻 GMC Sierra Under $10k Deal!,gmc sierra 1500 clearance sale - see [region] prices | see gmc sierra 1500 clearance sale - see [region] prices | find gmc sierra 1500 clearance sale - see [region] prices | gmc sierra 1500 clearance sales - see [region] prices | see gmc sierra 1500 clearance sales - see [region] prices,3,backend/runs/2025-10-20_593450633843471/
Dinero Gratis Para Comprar Casa — ¡Revisa Aquí!,Assist Me in Getting a House | Help Me Get a House in [state] by 2025 | Assist Me in Getting a House by 2025 | Help Me Get a House in [state] in 2025 | Assist Me in Getting a House in 2025,11,backend/runs/2025-10-20_593450633843471/
Full Botox Treatment — Only $119!,get $119 botox doctor near me full botox | $119 botox doctor near me full botox | see $119 botox doctor near me full botox | find $119 botox doctor near me full botox | must-see $119 botox doctor near me full botox,14,backend/runs/2025-10-20_593450633843471/
🚀 Govt-Funded LPN Training 📚 Train as an Licensed Nurse Practitioner — 100% government-funded!,3 weeks lpn online course {region_code} approved | become an lpn in 3 weeks {region_code} approved | government-funded lpn education | 3 weeks lpn online course {city} approved | become an lpn in 3 weeks {city} approved,4,backend/runs/2025-10-20_593450633843471/
Botox completo solo $149 Obtener brillante con Botox completo en solo $ 149-belleza gana aquí 💉 https://everydaysolutions.,Get $149 Botox Doctor Near Me Full Botox | $149 Botox Doctor Near Me Full Botox | Get $149 Botox Doctor Nearby Full Botox | Get $149 Botox Doctor Near [city] Full Botox | Get $149 Botox Doctor Near [region] Full Botox,4,backend/runs/2025-10-20_593450633843471/
Full Botox Only $119 Get glowing with full Botox at just $119—beauty wins here 💉 everydaysolutions.,Get $119 Botox Doctor Near Me Full Botox | $119 Botox Doctor Near Me Full Botox | Get $119 Botox Doctor Nearby Full Botox | Get $119 Botox Doctor Near [city] Full Botox | Get $119 Botox Doctor Near [region] Full Botox,3,backend/runs/2025-10-20_593450633843471/
Everyday Solutions III Get glowing with full Botox at just $119—beauty wins here 💉 everydaysolutions.,Get $119 Botox Doctor Near Me Full Botox | $119 Botox Doctor Near Me Full Botox | Get $119 Botox Doctor Nearby Full Botox | Get $119 Botox Doctor Near [city] Full Botox | Get $119 Botox Doctor Near [region] Full Botox,1,backend/runs/2025-10-20_593450633843471/
{{product.,Get $119 Botox Doctor Near Me Full Botox | $119 Botox Doctor Near Me Full Botox | Get $119 Botox Doctor Nearby Full Botox | Get $119 Botox Doctor Near [city] Full Botox | Get $119 Botox Doctor Near [region] Full Botox,4,backend/runs/2025-10-20_593450633843471/
Rent Limited to 30 Percent 🏠 Rent capped at just 30% of your income?,55 and older apartments near me | see 55 and older apartments near me | find 55 and older apartments near me | 55 and older apartment near me | discover 55 and older apartments near me,3,backend/runs/2025-10-20_593450633843471/
Low Cost Pet Insurance For Seniors 🐾 💸 Love your furry friend?,pet insurance quotes | pet insurance quotes ($10/month) | pet insurance for dogs ($10/month) | pet insurance for dogs | 2024 pet insurance quotes ($10/month),4,backend/runs/2025-10-20_593450633843471/
🏠 Casas Sin Enganche Cerca de Ti ¿Sueñas con tener casa propia pero te preocupa el enganche?,i want to buy a house with no money | i want to buy a home with no money | how to buy a house with no money | discover how to buy a house with no money | see how to buy a house with no money,5,backend/runs/2025-10-20_593450633843471/
Drive your new truck with zero down Drive your dream truck today!,100 accepted 0 down options new f150 and ram trucks near me [at no cost] apply now | find 100 accepted 0 down options new f150 and ram trucks near me [at no cost] apply now | 100 accepted 0 down options new f150 and ram trucks near me [at no cost] apply now near you | get 100 accepted 0 down options new f150 and ram trucks near me [at no cost] apply now | apply for 100 accepted 0 down options new f150 and ram trucks near me [at no cost] apply now,2,backend/runs/2025-10-20_674166542440211/
¡Solo $249 al mes por vivienda para mayores!,best senior living options for $249/mo | senior living options for $249/mo | find senior living options for $249/mo | best senior living options for $249/month | senior living options for $249/month,14,backend/runs/2025-10-20_674166542440211/
Juvederm treatments at surprisingly low prices Smooth out wrinkles and restore volume — Juvederm treatments are more affordable than ever.,juvéderm clinics near me | find juvéderm clinics near me | see juvéderm clinics near me | must-see juvéderm clinics near me | must see juvéderm clinics near me,3,backend/runs/2025-10-20_674166542440211/
Get paid to learn — start driving today Get paid while you train!,pickup driver career | find pickup driver career | pickup driver career near you | start pickup driver career | apply for pickup driver career,1,backend/runs/2025-10-20_674166542440211/
Take back your independence today Regain your freedom with a Medicare-covered mobility scooter — no out-of-pocket costs for those who qualify.,applying for medicare-covered mobility scooters asap - 100 coverage | apply for medicare-covered mobility scooters asap - 100 coverage | find applying for medicare-covered mobility scooters asap - 100 coverage | applying for medicare-covered mobility scooters asap - 100 coverage near you | get applying for medicare-covered mobility scooters asap - 100 coverage,3,backend/runs/2025-10-20_674166542440211/
Grand Cherokee From $100/Month Don’t miss this: Grand Cherokee SUV deals starting at just $100/month—available now in your area.,$100/month ‐ Grand Cherokee 2024 Suvs Nearby | $100/month Grand Cherokee 2024 Suvs Nearby | $100/month ‐ Grand Cherokee 2024 Suvs Near me | $100/month ‐ Grand Cherokee 2024 Suv Nearby | $100/month ‐ Grand Cherokee 2025 Suvs Nearby,13,backend/runs/2025-10-20_674166542440211/
Medications Linked to Atrial Fibrillation 💊 New research reveals medications linked to atrial fibrillation—see which drugs could increase your risk.,paroxysmal atrial fibrillation anticoagulation | atrial fibrillation medications | anticoagulation in elderly patients with atrial fibrillation | symptoms of atrial fibrillation in elderly | early detection of atrial fibrillation,2,backend/runs/2025-10-20_674166542440211/
Talk to a Local Immigration Lawyer 🌎 Need immigration assistance?,Immigration attorneys in Santa Monica | Immigration attorney in California | Find an immigration lawyer | Get an immigration lawyer quickly | Find immigration lawyer in my area,3,backend/runs/2025-10-20_674166542440211/
Internet desde $19 ¡Tu código postal califica!,$19.99 Internet Providers in My Zip Code | see $19.99 Internet Providers in My Zip Code | find $19.99 Internet Providers in My Zip Code | $19.99 Internet Provider in My Zip Code | get $19.99 Internet Providers in My Zip Code,29,backend/runs/2025-10-20_674166542440211/
Instant Rogue Approval Want a Nissan Rogue?,nearby rogue - zero down 100 accepted suvs | find nearby rogue - zero down 100 accepted suvs | get nearby rogue - zero down 100 accepted suvs | see nearby rogue - zero down 100 accepted suvs | nearby rogue - zero down 100 accepted suv,14,backend/runs/2025-10-20_674166542440211/
Tree Removal for Just $49 – See If You Qualify!,Tree Cutting Service for $49 Near My Zipcode | Tree Cutting Services for $49 Near My Zipcode | Tree Cutting Service Near My Zipcode for $49 | Tree Cutting Services Near My Zipcode for $49 | Tree Cutting Service for $49 Near Me,136,backend/runs/2025-10-20_674166542440211/
Ram 2024 por $100/Mes La Dodge Ram 2024 está aquí por solo $100 al mes.,$100/month - Dodge Ram 2024 Nearby | $100/month - Dodge Ram 2024 Near Me | $100/month Dodge Ram 2024 Nearby | See $100/month - Dodge Ram 2024 Nearby | Find $100/month - Dodge Ram 2024 Nearby,32,backend/runs/2025-10-20_674166542440211/
"$99 Laser Skin Rejuvenation Get fresh, rejuvenated skin with laser treatments.",Laser skin rejuvenation [city] | Laser skin rejuvenation in [city] | Facial Laser Rejuvenation Treatment | Face Rejuvenation Laser Treatment | Facial Laser Treatment,36,backend/runs/2025-10-20_674166542440211/
$99 Laser Skin Rejuvenation Rejuvenate Your Skin!,Laser skin rejuvenation [city] | Laser skin rejuvenation in [city] | Facial Laser Rejuvenation Treatment | Face Rejuvenation Laser Treatment | Facial Laser Treatment,1,backend/runs/2025-10-20_674166542440211/
"Budget-Friendly 55+ Apartments Revealed Discover hidden affordable apartment options designed for those 55+, with benefits you might not expect.",55 and older apartments near me | see 55 and older apartments near me | find 55 and older apartments near me | 55 and older apartment near me | discover 55 and older apartments near me,19,backend/runs/2025-10-20_674166542440211/
Comidas Gratis a Domicilio para Adultos Mayores 🥗 Los adultos mayores pueden calificar para recibir comidas nutritivas gratis directamente en su puerta—descubre hoy si tú o un ser,home delivered meals for seniors no cost | $0 meal delivery | free home delivered meals for seniors near me | free home delivered meals for seniors | $0 meal delivery in [city],4,backend/runs/2025-10-20_674166542440211/
Seniors: Get $10/Mo Internet 💸 Internet for $10?,$10 Internet Providers in My Zip Code | find $10 Internet Providers in My Zip Code | see $10 Internet Providers in My Zip Code | $10 Internet Provider in My Zip Code | get $10 Internet Providers in My Zip Code,14,backend/runs/2025-10-20_674166542440211/
Dinero Gratis Para Baños Desbloquea subvenciones secretas para renovar tu elegibilidad de verificación de baño ahora.,bathroom remodel paid by grants [region] | bathroom remodel paid by grants  | get bathroom remodel paid by grants  | find bathroom remodel paid by grants  | bathroom remodel paid for by grants ,7,backend/runs/2025-10-20_674166542440211/
Senior Living From $499/Month 🏡 🏡 Discover 55+ senior living communities starting at just $499/month—affordable comfort without compromise.,$499/mo 55 and Older Apartments Near Me | $499/mo Senior Living | $499/mo 55 and Older Apartments in [city] | $499/mo 55 and Older Apartments in [region] | $499/mo 55  Apartments,2,backend/runs/2025-10-20_674166542440211/
{{product.,Laser skin rejuvenation [city] | Laser skin rejuvenation in [city] | Facial Laser Rejuvenation Treatment | Face Rejuvenation Laser Treatment | Facial Laser Treatment,2,backend/runs/2025-10-20_674166542440211/
Seniors Under 85 Can Own a GMC Sierra for Less Than $10K!,gmc sierra 1500 clearance sale - see [region] prices | see gmc sierra 1500 clearance sale - see [region] prices | find gmc sierra 1500 clearance sale - see [region] prices | must-see gmc sierra 1500 clearance sale - see [region] prices | must see gmc sierra 1500 clearance sale - see [region]prices,1,backend/runs/2025-10-20_674166542440211/
Senior Living for $249!,best senior living options for $249/mo | senior living options for $249/mo | find senior living options for $249/mo | best senior living options for $249/month | senior living options for $249/month,42,backend/runs/2025-10-20_674166542440211/
Tree Cutting From $9 Near You 🌳 Tree removal starting at just $9—see if your ZIP qualifies today.,$9 tree cutting service (near my zipcode) | find $9 tree cutting service (near my zipcode) | discover $9 tree cutting service (near my zipcode) | $9 tree cutting service near me | $9 tree cutting service nearby,26,backend/runs/2025-10-20_674166542440211/
{{product.,$9 tree cutting service (near my zipcode) | find $9 tree cutting service (near my zipcode) | discover $9 tree cutting service (near my zipcode) | $9 tree cutting service near me | $9 tree cutting service nearby,13,backend/runs/2025-10-20_674166542440211/
Obtén dinero gratis para comprar una casa ¿Necesitas una casa?,Help me get a house | Assist me in getting a house | Help me get a house in {city} | Help me get a house in 2025 | Help me get a house in {region} by 2025,22,backend/runs/2025-10-20_674166542440211/
Seniors: Rent Starts Low Senior apartments for just $499/month?,499/mo 55 and older apartments near me [state] | 499/mo 55 and older apartments nearby | 499/mo 55 and older apartments near me | see 499/mo 55 and older apartments | find 499/mo 55 and older apartments,10,backend/runs/2025-10-20_674166542440211/
"Laser Skin Rejuvenation Without Breaking Bank Get fresh, rejuvenated skin with laser treatments.",Laser skin rejuvenation [city] | Laser skin rejuvenation in [city] | Facial Laser Rejuvenation Treatment | Face Rejuvenation Laser Treatment | Facial Laser Treatment,3,backend/runs/2025-10-20_674166542440211/
$10 Internet?,affordable internet providers in my area | $10 internet providers in my zip code | see $10 internet in my zip code | $10 internet for seniors in my zip code | $10 internet providers in [city],2,backend/runs/2025-10-20_674166542440211/
"Free Meals for Seniors Delivered 🥗 Seniors may qualify for free, nutritious meals delivered right to their doorstep—see if you or a loved one are eligible today.",home delivered meals for seniors no cost | $0 meal delivery | free home delivered meals for seniors near me | free home delivered meals for seniors | free home delivered meals for seniors in [city],4,backend/runs/2025-10-20_674166542440211/
Internet desde $10 Proveedores de internet desde $10 ya disponibles en tu zona.,$10 Internet Providers in My Zip Code | find $10 Internet Providers in My Zip Code | see $10 Internet Providers in My Zip Code | $10 Internet Provider in My Zip Code | get $10 Internet Providers in My Zip Code,10,backend/runs/2025-10-20_674166542440211/
Dinero Gratis Para Baños Desbloquea subvenciones secretas para renovar tu elegibilidad de verificación de baño ahora.,bathroom remodel paid by grants [region] | bathroom remodel paid by grants | get bathroom remodel paid by grants | find bathroom remodel paid by grants | bathroom remodel paid for by grants,7,backend/runs/2025-10-20_674166542440211/
"Botox for $149—Yes, Really!",get $149 botox doctor near me full botox | Botox full face for $149 near me | find $149 botox doctor near me | $149 full botox doctor in my area | get $149 botox doctor near [region],4,backend/runs/2025-10-20_674166542440211/
"GMC Sierra 1500 Desde Menos de $10,000 ¿Una GMC Sierra 1500 por menos de $10,000?",Find Gmc Sierra Clearance Sale - See [state] Prices | Gmc Sierra Clearance Sale - See [state] Prices | Must-see Gmc Sierra Clearance Sale - See [state] Prices | Must See Gmc Sierra Clearance Sale - See [state] Prices | Gmc Sierra Clearance Sale - See [state] Price,8,backend/runs/2025-10-20_674166542440211/
Botox completo solo $119 Luce radiante con Botox completo por solo $119—la belleza gana aquí https://nextanswers.,Get $119 Botox Doctor Near Me Full Botox | $119 Botox Doctor Near Me Full Botox | Get $119 Botox Doctor Nearby Full Botox | Get $119 Botox Doctor Near [city] Full Botox | Get $119 Botox Doctor Near [region] Full Botox,4,backend/runs/2025-10-20_674166542440211/
Full Botox Treatment — Only $119!,Get $119 Botox Doctor Near Me Full Botox | $119 Botox Doctor Near Me Full Botox | Get $119 Botox Doctor Nearby Full Botox | Get $119 Botox Doctor Near [city] Full Botox | Get $119 Botox Doctor Near [region] Full Botox,4,backend/runs/2025-10-20_674166542440211/
$249/Month Senior Living!,Senior Living Options for $249/month | see Senior Living Options for $249/month | find Senior Living Options for $249/month | must see Senior Living Options for $249/month | must-see Senior Living Options for $249/month,18,backend/runs/2025-10-20_674166542440211/
Capacitación CDL gratuita y con pago.,trucking companies that get you your cdl | see trucking companies that get you your cdl | find trucking companies that get you your cdl | trucking companies that get you cdl | discover trucking companies that get you your cdl,8,backend/runs/2025-10-20_674166542440211/
Full Botox Treatment — Only $119!,Get $119 Botox Doctor Near Me Full Botox | $119 Botox Doctor Near Me Full Botox | See $119 Botox Doctor Near Me Full Botox | Find $119 Botox Doctor Near Me Full Botox | Must-see $119 Botox Doctor Near Me Full Botox,11,backend/runs/2025-10-20_674166542440211/
Free Cash for Bathrooms Unlock secret grants to remodel your bathroom—check eligibility now.,bathroom remodel paid by grants [region] | bathroom remodel paid by grants | get bathroom remodel paid by grants | find bathroom remodel paid by grants | bathroom remodel paid for by grants,11,backend/runs/2025-10-20_674166542440211/
{{product.,,4,backend/runs/2025-10-20_674166542440211/
Presupuesto Implantes Dentales Cerca de Usted Clínicas cercanas que ofrecen implantes dentales desde solo $150.,,10,backend/runs/2025-10-20_674166542440211/
¡Vivienda para mayores por $249!,best senior living options for $249/mo | senior living options for $249/mo | find senior living options for $249/mo | best senior living options for $249/month | senior living options for $249/month,6,backend/runs/2025-10-20_674166542440211/
Tree Removal for Just $49 – See If You Qualify!,tree cutting service for $49 near my [zip] | tree cutting services for $49 near my [zip] | tree cutting service near my [zip] for $49 | tree cutting services near my [zip] for $49 | tree cutting service for $49 near me,6,backend/runs/2025-10-20_674166542440211/
Tree Removal for Just $49 – See If You Qualify!,tree cutting service for $49 near my zipcode | tree cutting services for $49 near my zipcode | tree cutting service near my zipcode for $49 | tree cutting services near my zipcode for $49 | tree cutting service for $49 near me,2,backend/runs/2025-10-20_674166542440211/
Internet from $19 Your ZIP code qualifies!,$19.99 Internet Providers in My Zip Code | see $19.99 Internet Providers in My Zip Code | find $19.99 Internet Providers in My Zip Code | $19.99 Internet Provider in My Zip Code | get $19.99 Internet Providers in My Zip Code,6,backend/runs/2025-10-20_674166542440211/
Seniors: Get $10/Mo Internet 💸 Internet for $10?,$10 internet providers in my zip code | find $10 internet providers in my zip code | see $10 internet providers in my zip code | $10 internet provider in my zip code | get $10 internet providers in my zip code,4,backend/runs/2025-10-20_674166542440211/
Get Free Money To Buy A Home Need a house?,Help me get a house | Assist me in getting a house | Help me get a house in {city} | Help me get a house in 2025 | Help me get a house in {region} by 2025,3,backend/runs/2025-10-20_674166542440211/
👉 Check If You Qualify for Free Fat Removal Today!,,6,backend/runs/2025-10-20_793983330455470/
Affordable Botox Treatments Smooth your look without overspending.,,9,backend/runs/2025-10-20_793983330455470/
"$4,000 for Doing Almost Nothing – Sleep Apnea Trial Paying NOW!",,9,backend/runs/2025-10-20_793983330455470/
Get Your Permanent Dental Implants NOW – 100% FREE!,,12,backend/runs/2025-10-20_793983330455470/
"Earn $1,500 + FREE Treatment—Join This Study TODAY!",,7,backend/runs/2025-10-20_793983330455470/
💉 Botox From $3/Unit – Limited-Time Offer!,,5,backend/runs/2025-10-20_793983330455470/
💥 FREE Dental Implants + Cash — See If You Qualify NOW!,,3,backend/runs/2025-10-20_793983330455470/
"Neuropathy Patients Wanted – $3,000 Reward 💰 Researchers are looking for neuropathy trial participants right now.",,8,backend/runs/2025-10-20_793983330455470/
Compra tu Casa con Dinero Gratis: Descubre Cómo ¿Quieres comprar una casa pero no tienes dinero?,Help me get a house | Assist me in getting a house | Help me get a house in {city} | Help me get a house in 2025 | Help me get a house in {region} by 2025,8,backend/runs/2025-10-21_3pages/
$249/Month Senior Living!,Senior Living Options for $249/month | see Senior Living Options for $249/month | find Senior Living Options for $249/month | must see Senior Living Options for $249/month | must-see Senior Living Options for $249/month,43,backend/runs/2025-10-21_3pages/
Tree Removal for Just $49 – See If You Qualify!,tree cutting service for $49 near my zipcode | tree cutting services for $49 near my zipcode | tree cutting service near my zipcode for $49 | tree cutting services near my zipcode for $49 | tree cutting service for $49 near me,9,backend/runs/2025-10-21_3pages/
Botox completo solo $119 Luce radiante con Botox completo por solo $119—la belleza gana aquí everydaysolutions.,get $119 botox doctor near me full botox | $119 botox doctor near me full botox | get $119 botox doctor nearby full botox | Get $119 Botox Doctor Near [city] Full Botox | Get $119 Botox Doctor Near [region] Full Botox,12,backend/runs/2025-10-21_3pages/
Botox completo solo $119 Luce radiante con Botox completo por solo $119—la belleza gana aquí everydaysolutions.,Get $119 Botox Doctor Near Me Full Botox | $119 Botox Doctor Near Me Full Botox | Get $119 Botox Doctor Nearby Full Botox | Get $119 Botox Doctor Near [city] Full Botox | Get $119 Botox Doctor Near [region] Full Botox,11,backend/runs/2025-10-21_3pages/
Teléfonos Gratis para Adultos Mayores Celulares económicos y fáciles de usar esperan por los adultos mayores.,discounted senior phone plans | get discounted senior phone plans | discounted phones for seniors 60 and older | discounted phones for seniors 60 | best discounted senior phone plans,39,backend/runs/2025-10-21_3pages/
Comunidades para adultos mayores que están dando de qué hablar en 2025 ¿Estás pensando en mudarte?,55 plus apartments | 55 and older apartments | new 55 plus communities | 55 plus new construction | homes for 55 and older,4,backend/runs/2025-10-21_3pages/
🛻 GMC Sierra Under $10k Deal!,gmc sierra 1500 clearance sale - see [region] prices | see gmc sierra 1500 clearance sale - see [region] prices | find gmc sierra 1500 clearance sale - see [region] prices | gmc sierra 1500 clearance sales - see [region] prices | see gmc sierra 1500 clearance sales - see [region] prices,3,backend/runs/2025-10-21_3pages/
Dinero Gratis Para Comprar Casa — ¡Revisa Aquí!,Assist Me in Getting a House | Help Me Get a House in [state] by 2025 | Assist Me in Getting a House by 2025 | Help Me Get a House in [state] in 2025 | Assist Me in Getting a House in 2025,11,backend/runs/2025-10-21_3pages/
Full Botox Treatment — Only $119!,get $119 botox doctor near me full botox | $119 botox doctor near me full botox | see $119 botox doctor near me full botox | find $119 botox doctor near me full botox | must-see $119 botox doctor near me full botox,14,backend/runs/2025-10-21_3pages/
🚀 Govt-Funded LPN Training 📚 Train as an Licensed Nurse Practitioner — 100% government-funded!,3 weeks lpn online course {region_code} approved | become an lpn in 3 weeks {region_code} approved | government-funded lpn education | 3 weeks lpn online course {city} approved | become an lpn in 3 weeks {city} approved,4,backend/runs/2025-10-21_3pages/
Botox completo solo $149 Obtener brillante con Botox completo en solo $ 149-belleza gana aquí 💉 https://everydaysolutions.,Get $149 Botox Doctor Near Me Full Botox | $149 Botox Doctor Near Me Full Botox | Get $149 Botox Doctor Nearby Full Botox | Get $149 Botox Doctor Near [city] Full Botox | Get $149 Botox Doctor Near [region] Full Botox,4,backend/runs/2025-10-21_3pages/
