hook,forcekeys,unique_ad_count,run_dir
Creative Ways to Enhance Quality Time with Your Partner Find unique and innovative ideas for spending quality time together.,,1,backend/runs/2025-10-21_40libs/
Discover Possible Pfizer Vaccine Side Effects Looking for answers about Pfizer mRNA vaccine effects?,,1,backend/runs/2025-10-21_40libs/
💆‍♀️ Ease discomfort fast with solutions that might improve your daily comfort.,,8,backend/runs/2025-10-21_40libs/
At Home Generators Best Home Generators: Power When You Need It Most instanswers.,,4,backend/runs/2025-10-21_40libs/
📦 Running out of room?,,4,backend/runs/2025-10-21_40libs/
Looking for the right immigration lawyer in Canada?,,9,backend/runs/2025-10-21_40libs/
🌳 Tree removal starting at just $9—see if your ZIP qualifies today.,,3,backend/runs/2025-10-21_40libs/
🏖️ Curious about Gulf Shores vacation bungalows?,,7,backend/runs/2025-10-21_40libs/
Learn more about How may Earn from Watching Videos: An Informative guide only!,,1,backend/runs/2025-10-21_40libs/
Struggling with lower back pain?,,3,backend/runs/2025-10-21_40libs/
Best Home Generators: Power When You Need It Most,,4,backend/runs/2025-10-21_40libs/
Learn more about expert PPC strategies to increase website traffic and sales.,,8,backend/runs/2025-10-21_40libs/
Discover More About PPC Advertising Agencies for Business Growth👉 Learn more about expert PPC strategies to increase website traffic and sales.,,1,backend/runs/2025-10-21_40libs/
"Read more: Asian Massage 💆‍♀️ From acupressure to deep tissue techniques, Asian massage offers a holistic way to relieve tension and restore balance.",,1,backend/runs/2025-10-21_40libs/
{{product.,,19,backend/runs/2025-10-21_40libs/
Chèque Énergie Électricité 2025 Baissez vos dépenses d'énergie grâce au chèque énergie.,,2,backend/runs/2025-10-21_40libs/
Chèque Énergie Électricité 2025 Allégez vos frais d'électricité grâce au chèque énergie.,,2,backend/runs/2025-10-21_40libs/
Chèque Énergie Électricité 2025 Réduisez vos factures d'électricité avec le chèque énergie.,,5,backend/runs/2025-10-21_40libs/
Free Construction Management Certificate Build your construction management career with free professional certification.,,19,backend/runs/2025-10-21_40libs/
Encuentra un Abogado Gratis ¡Ayuda legal gratuita disponible ahora!,,6,backend/runs/2025-10-21_40libs/
Spain Full Scholarship Programs Transform your future with fully funded scholarships to Spain's top universities.,,11,backend/runs/2025-10-21_40libs/
Free Phlebotomy Certificate Training Launch your medical career with free phlebotomy training and certification.,,6,backend/runs/2025-10-21_40libs/
Curso Gratuito de Enfermería Certificado Impulsa tu carrera en salud con cursos gratuitos de enfermería con certificado.,,9,backend/runs/2025-10-21_40libs/
Curso Electricista Gratuito Certificado Conviértete en electricista certificado sin inversión inicial.,,6,backend/runs/2025-10-21_40libs/
Learn About Nutritional Supplements for Dementia Many are exploring the information about food supplements for dementia prevention and memory support.,,7,backend/runs/2025-10-21_40libs/
Explore Information About Cellulite Reduction Treatment Options Curious about popular cellulite reduction treatments?,,16,backend/runs/2025-10-21_40libs/
Understanding Signs of Depression in Seniors Curious about how to identify depression signs in seniors?,,2,backend/runs/2025-10-21_40libs/
Curious about ways to enhance eye health?,,1,backend/runs/2025-10-21_40libs/
Learn About Foods That Support Brain Health Many are exploring ways to promote brain health as they age.,,1,backend/runs/2025-10-21_40libs/
Many are exploring options for achieving a radiant complexion.,,11,backend/runs/2025-10-21_40libs/
Learn about creating a peaceful in-home massage experience that promotes relaxation.,,1,backend/runs/2025-10-21_40libs/
Learn About Home Massages in 2025 sportfoy.,,4,backend/runs/2025-10-21_40libs/
Learn About the Benefits of Spa Treatments Learn how visiting local spa salons can be a great avenue for achieving ultimate relaxation.,,2,backend/runs/2025-10-21_40libs/
Explore Information on Advances in Erectile Dysfunction Research Understanding erectile dysfunction?,,2,backend/runs/2025-10-21_40libs/
Learn About Weight Loss Injection Benefits Many are exploring weight loss injections as a potential tool for effective weight management.,,2,backend/runs/2025-10-21_40libs/
Läs mer🔎 Badrumsrenovering: Inspiration och praktiska tips för ett funktionellt och elegant utrymme✨ browsebrain.,,5,backend/runs/2025-10-21_40libs/
{{product.,Peripheral Neuropathy Treatment Centers Near Me California | Neuropathy Treatment Centers of California | Diabetic Neuropathy Treatment Trials Near Me{State} | Diabetic Neuropathy Treatment Trials Near Me | $1500 for Neuropathy Research California,1,backend/runs/2025-10-21_40libs/
{{product.,Diabetic Neuropathy Treatment Trials Near Me | Peripheral Neuropathy Clinical Studies in {State} | New Neuropathy Pain Relief Clinical Trial {City} | Nerve Damage Treatment Research USA | Paid Neuropathy Study Volunteers Needed in {State},33,backend/runs/2025-10-21_40libs/
Belly Fat Clinical Studies – Learn More 🔬 Local research studies on non-surgical belly fat reduction ✨ checkbeforesearch.,$1500 for Belly Fat Removal Without Surgery Participation {State} | $1500 for Belly Fat Removal Without Surgery Participation {City} | $1500 for Cryolipolysis Belly Fat Reduction Study {State} | $1500 for Cryolipolysis Belly Fat Reduction Study {City} | $1500 for Non-invasive Fat Reduction Research {State},3,backend/runs/2025-10-21_40libs/
Neuropathy Treatment Studies – Learn More 📰 New research studies are testing potential treatments for nerve pain and neuropathy 🔬 checkbeforesearch.,Neuropathy Treatment Centers of {City} | Neuropathic Pain Relief Clinics | Neuropathy Specialist {City} | Neuropathy Treatment Centers of  {State} | Neuropathy Treatment Centers Near Me,4,backend/runs/2025-10-21_40libs/
Neuropathy Treatment Studies – Learn More 📰 New research studies are testing potential treatments for nerve pain and neuropathy 🔬 checkbeforesearch.,Peripheral Neuropathy Treatment Centers Near Me | Peripheral Neuropathy Treatment Centers Near Me {City} | Peripheral Neuropathy Treatment Centers Near Me {State} | Diabetic Neuropathy Treatment Trials Near Me | Diabetic Neuropathy Treatment Trials Near Me {City},5,backend/runs/2025-10-21_40libs/
Hair Regrowth Research Studies – Learn More 📰 Researchers are studying new options that could support hair regrowth in men and women 🔬 checkbeforesearch.,Qualify for Paid Clinical Trial Hair Regrowth Near Me | Best Paid Hair Regrowth Clinical Trials Near Me 2025 | Qualify for Hair Regrowth Clinical Trial Near Me | Hair Regrowth Clinical Trials with Compensation | Participate in Hair Regrowth Trials,1,backend/runs/2025-10-21_40libs/
Beneficios de participar en ensayos clínicos de neuropatía Beneficios de participar en ensayos clínicos de neuropatía checkbeforesearch.,Neuropathy Treatment Centers of {City} | Neuropathic Pain Relief Clinics | Neuropathy Specialist {City} | Neuropathy Treatment Centers of  {State} | Neuropathy Treatment Centers Near Me,3,backend/runs/2025-10-21_40libs/
Beneficios de participar en ensayos clínicos de neuropatía Beneficios de participar en ensayos clínicos de neuropatía checkbeforesearch.,Peripheral Neuropathy Treatment Centers Near Me | Peripheral Neuropathy Treatment Centers Near Me {City} | Peripheral Neuropathy Treatment Centers Near Me {State} | Diabetic Neuropathy Treatment Trials Near Me | Diabetic Neuropathy Treatment Trials Near Me {City},1,backend/runs/2025-10-21_40libs/
Belly Fat Clinical Studies – Learn More 🔬 Local research studies on non-surgical belly fat reduction ✨ checkbeforesearch.,$1500 for Belly Fat Reduction Treatment Participation Near My Zipcode Coolsculpting | $1500 for Belly Fat Reduction Treatment Participation Near My Zipcode [coolsculpting] | $1500 for Non-invasive Fat Reduction Research Near My Zipcode [coolsculpting] | $1500 for Non-invasive Fat Reduction Research Near My Zipcode Coolsculpting | $1500 for Cryolipolysis Belly Fat Reduction Study Near My Zipcode Coolsculpting,1,backend/runs/2025-10-21_40libs/
Belly Fat Clinical Studies – Learn More 🔬 Local research studies on non-surgical belly fat reduction ✨ checkbeforesearch.,Belly Fat Removal Treatment Centers Near Me | Belly Fat Removal Treatment Centers in {State} | Belly Fat Removal Treatment Centers Near Me {State} | Belly Fat Removal Treatment Centers Near Me {City} | $1500 for Cryolipolysis Belly Fat Reduction Study {State},1,backend/runs/2025-10-21_40libs/
Learn More 🔬 New options are being studied to support men with erectile dysfunction ✨ checkbeforesearch.,,3,backend/runs/2025-10-21_40libs/
💪 Más información ¿Dolor o entumecimiento?,Diabetic Neuropathy Treatment Trials Near Me | Peripheral Neuropathy Clinical Studies in {State} | New Neuropathy Pain Relief Clinical Trial {City} | Nerve Damage Treatment Research USA | Paid Neuropathy Study Volunteers Needed in {State},1,backend/runs/2025-10-21_40libs/
💪 Más información ¿Dolor o entumecimiento?,Peripheral Neuropathy Treatment Centers Near Me | Peripheral Neuropathy Treatment Centers Near Me {City} | Peripheral Neuropathy Treatment Centers Near Me {State} | Diabetic Neuropathy Treatment Trials Near Me | Diabetic Neuropathy Treatment Trials Near Me {City},3,backend/runs/2025-10-21_40libs/
"🚙 Learn About F150 vs Ram 1500 These two truck models continue to dominate roads for a reason—explore how they stack up in power, price, and features.",,2,backend/runs/2025-10-21_40libs/
{{product.,55 and older apartments near me | 55 and older apartment near me | see 55 and older apartments near me | find 55 and older apartments near me | see 55 and older apartment near me,2,backend/runs/2025-10-21_40libs/
{{product.,Repair Contractor in {state} | Home Repair Contractor Near Me | Repair Contractor in Santa Monica | Repair Contractors in {state} | Repair Contractors in Santa Monica,3,backend/runs/2025-10-21_40libs/
{{product.,Independent Work as Pickup Driver | Highest Paying Pickup Truck Driver Jobs | Small Truck Driver Jobs | Driver Hiring | Hiring Drivers Now,3,backend/runs/2025-10-21_40libs/
{{product.,Painting Companies in My Area | Painting Company in My Area | Local Painter Contractors | Home Painting Companies in Santa Monica | Local House Painters Santa Monica,1,backend/runs/2025-10-21_40libs/
Learn About Painting Job Opportunities Some employers may have openings for Painting.,Painting Companies in My Area | Painting Company in My Area | Local Painter Contractors | Home Painting Companies in Santa Monica | Local House Painters Santa Monica,2,backend/runs/2025-10-21_40libs/
Learn About Power Washing Job Opportunities Some employers may have openings for Power Washing.,Pressure Cleaning Near Me | Pressure Cleaning Companies Near Me | Pressure Cleaning Nearby | Pressure Washing Companies Near Santa Monica | Pressure Washing Companies Santa Monica,3,backend/runs/2025-10-21_40libs/
{{product.,Pressure Cleaning Near Me | Pressure Cleaning Companies Near Me | Pressure Cleaning Nearby | Pressure Washing Companies Near Santa Monica | Pressure Washing Companies Santa Monica,3,backend/runs/2025-10-21_40libs/
Learn More About Back Pain Research Studies Back Pain clinical studies may be enrolling participants to evaluate new options for back pain.,$3000 Clinical Study for Relieving Lower Back Pain | Low Back Pain Study | See Effective $3000 Clinical Trials for Treating Lower Back Pain | See Effective Paid 3000 Clinical Trials for Treating Lower Back Pain | Effective $3000 Clinical Study for Lower Back Pain Treatment,2,backend/runs/2025-10-21_40libs/
{{product.,$3000 Clinical Study for Relieving Lower Back Pain | Low Back Pain Study | See Effective $3000 Clinical Trials for Treating Lower Back Pain | See Effective Paid 3000 Clinical Trials for Treating Lower Back Pain | Effective $3000 Clinical Study for Lower Back Pain Treatment,1,backend/runs/2025-10-21_40libs/
{{product.,Apply for Online School High School that Gives You a Computer Now | Apply for Online School High School that Give You a Computer Now | Apply for Online School High School that Gives You a Computer | Apply for Online School High Schools that Give You a Computer | Apply for Online School High School that Give You a Computer,3,backend/runs/2025-10-21_40libs/
Learn About Oxygen Concentrator Options for COPD Medicare may help cover oxygen concentrators if certain medical requirements are met.,Pay $0 for Portable Oxygen Concentrator With Medicare | Order Compact Copd Oxygen Concentrators Covered By Medicare Now | Claim Your Medicare Covered Copd Oxygen Concentrator | Claim Your Medicare Covered Copd Oxygen Concentrators | Compact Medicare Covered Copd Devices [at No Cost],1,backend/runs/2025-10-21_40libs/
{{product.,Travel Oxygen Concentrator | Wearable Oxygen Concentrator | Portable Oxygen Concentrator | Best Portable Oxygen Concentrator | Personal Portable Oxygen Concentrator for Seniors,1,backend/runs/2025-10-21_40libs/
{{product.,Pay $0 for Portable Oxygen Concentrator With Medicare | Order Compact Copd Oxygen Concentrators Covered By Medicare Now | Claim Your Medicare Covered Copd Oxygen Concentrator | Claim Your Medicare Covered Copd Oxygen Concentrators | Compact Medicare Covered Copd Devices [at No Cost],1,backend/runs/2025-10-21_40libs/
{{product.,Get $149 Botox Doctor Near Me Full Botox | Best Botox Injector Near Me | $119 Botox Doctor Near Me Full Botox | See $119 Botox Doctor Near Me Full Botox | Get $119 Botox Doctor Near Santa Monica Full Botox,2,backend/runs/2025-10-21_40libs/
"Explore Botox Consultation and Pricing Details The cost of Botox may range depending on procedure type, number of units, and provider.",Get $149 Botox Doctor Near Me Full Botox | Best Botox Injector Near Me | $119 Botox Doctor Near Me Full Botox | See $119 Botox Doctor Near Me Full Botox | Get $119 Botox Doctor Near Santa Monica Full Botox,1,backend/runs/2025-10-21_40libs/
{{product.,$1500 for Dental Implants Participation | Participate in Dental Implants Trial [sign Up Now] | No-fee Dental Implants | Get $1500 for Dental Implants Participation | $1950 for Dental Implants Participation [search Now],1,backend/runs/2025-10-21_40libs/
Learn More About Dental Implant Research Studies Dental Implants trials may be testing new methods for dental implants.,$1500 for Dental Implants Participation | Participate in Dental Implants Trial [sign Up Now] | No-fee Dental Implants | Get $1500 for Dental Implants Participation | $1950 for Dental Implants Participation [search Now],2,backend/runs/2025-10-21_40libs/
{{product.,Paid Arthritis Clinical Trials | Finding Arthritis Trials Near Me | $1500 for Osteoarthritis Trial {state} | Arthritis Paid Clinical Trials | Paid Arthritis Trials,2,backend/runs/2025-10-21_40libs/
Learn More About Arthritis Research Studies Arthritis clinical trials may be enrolling individuals to study new approaches to arthritis.,Paid Arthritis Clinical Trials | Finding Arthritis Trials Near Me | $1500 for Osteoarthritis Trial {state} | Arthritis Paid Clinical Trials | Paid Arthritis Trials,1,backend/runs/2025-10-21_40libs/
{{product.,Diabetes Clinical Studies Testing New Treatments $13675 Near Me | Diabetes Studies Testing New Medications $1500 Near Me | Clinical Studies for Diabetes | Participate in Diabetes Research Trial Sign Up Today | Diabetes Studies Testing New Medication,3,backend/runs/2025-10-21_40libs/
{{product.,clinical trials for neuropathy near me {state} | clinical trials for neuropathy near me Santa Monica | $1500 for neuropathy research {state} | $1500 for neuropathy research Santa Monica | $1500 for neuropathy research trials {state},2,backend/runs/2025-10-21_40libs/
Learn More About Neuropathy Research Studies Neuropathy clinical studies may be evaluating new approaches to managing neuropathy.,clinical trials for neuropathy near me {state} | clinical trials for neuropathy near me Santa Monica | $1500 for neuropathy research {state} | $1500 for neuropathy research Santa Monica | $1500 for neuropathy research trials {state},1,backend/runs/2025-10-21_40libs/
Learn About Medicare Mobility Scooter Options Some individuals may qualify for Medicare coverage of mobility scooters if medical criteria are fulfilled.,applying for medicare-covered mobility scooters asap (100 coverage) | applying for medicare-covered mobility scooters right now | applying for medicare-covered mobility scooters fast near me for seniors | applying for medicare-covered mobility scooters asap - 100 coverage | see applying for medicare-covered mobility scooters asap (100 coverage),3,backend/runs/2025-10-21_40libs/
{{product.,Clinical Trials for Smokers | $6000 Clinical Study for Smokers in {state} | $6000 Clinical Study for Smokers in Santa Monica | Clinical Studies for Smokers | {state} $6000 Clinical Study for Smokers,1,backend/runs/2025-10-21_40libs/
Learn More About Smokers Research Studies Smokers clinical trials may be enrolling individuals who smoke to explore new study approaches.,Clinical Trials for Smokers | $6000 Clinical Study for Smokers in {state} | $6000 Clinical Study for Smokers in Santa Monica | Clinical Studies for Smokers | {state} $6000 Clinical Study for Smokers,2,backend/runs/2025-10-21_40libs/
Learn More About Sleep Apnea Research Studies Clinical trials may be enrolling individuals to study new approaches to sleep apnea.,Paid Research Studies for Sleep Apnea {state} | Paid Research Studies for Sleep Apnea Santa Monica | Paid Research Studies for Sleep Apnea | Sleep Apnea Paid Clinical Trial | $1500 for Sleep Apnea Treatment Clinical Trials {state},2,backend/runs/2025-10-21_40libs/
{{product.,Paid Research Studies for Sleep Apnea {state} | Paid Research Studies for Sleep Apnea Santa Monica | Paid Research Studies for Sleep Apnea | Sleep Apnea Paid Clinical Trial | $1500 for Sleep Apnea Treatment Clinical Trials {state},1,backend/runs/2025-10-21_40libs/
{{product.,100 Accepted | 0 Down Options - Rogue 2024 Crossover Suvs Nearby (rogue) [no Cost] | For Seniors: 2024 Rogue Crossover Suvs Nearby (rogue) [no Cost] | For Seniors: 2024 Rogue Crossover Suvs Nearby (rogue) no Cost | 100 Accepted | 0 Down Dealerships - Leftover Crossover Suvs Nearby no Cost (rogue) | For Seniors: 2025 Rogue Crossover Suvs Nearby (rogue) no Cost,1,backend/runs/2025-10-21_40libs/
Explore Deals on the Nissan Rogue SUV Car buyers are checking out current offers on the Nissan Rogue.,100 Accepted | 0 Down Options - Rogue 2024 Crossover Suvs Nearby (rogue) [no Cost] | For Seniors: 2024 Rogue Crossover Suvs Nearby (rogue) [no Cost] | For Seniors: 2024 Rogue Crossover Suvs Nearby (rogue) no Cost | 100 Accepted | 0 Down Dealerships - Leftover Crossover Suvs Nearby no Cost (rogue) | For Seniors: 2025 Rogue Crossover Suvs Nearby (rogue) no Cost,2,backend/runs/2025-10-21_40libs/
Learn About Free Phone Offers with New Plans Phone promotions linked to new plans are available from some providers.,Get a New Phone for Free | Free Phone and Plan | Free Phones for New Customers | Get a Free Cell Phone Today | $0 Down New Phones,2,backend/runs/2025-10-21_40libs/
{{product.,Get a New Phone for Free | Free Phone and Plan | Free Phones for New Customers | Get a Free Cell Phone Today | $0 Down New Phones,1,backend/runs/2025-10-21_40libs/
Learn How Gold IRAs Can Help Diversify Savings Many people are looking into Gold IRAs as a way to protect and diversify their retirement funds.,Get Free Gold IRA Kit With $10k | Gold Ira Kits [$0 Cost] | Gold Ira Kit [$0 Cost] | Free Gold IRA Kit U2013 No Cost | Free Gold Ira Kits U2013 no Cost,3,backend/runs/2025-10-21_40libs/
learn more cna https://goo.,,19,backend/runs/2025-10-21_40libs/
learn more cna beeswallet.,,1,backend/runs/2025-10-21_40libs/
learn more cna searchtopnewsglobal.,,1,backend/runs/2025-10-21_40libs/
learn more psw https://goo.,,4,backend/runs/2025-10-21_40libs/
Learn More🔍 psw https://goo.,,4,backend/runs/2025-10-21_40libs/
Learn More🔍 cna https://goo.,,2,backend/runs/2025-10-21_40libs/
"Skilled, Certified, and Paid: Everything You Need to Know About Paid CNA Training learn more https://goo.",,1,backend/runs/2025-10-21_40libs/
Botox for Only $119 Full Botox treatment for only $119?,get $119 botox doctor near me full botox | $119 botox doctor near me full botox | get $119 botox doctor nearby full botox | Get $119 Botox Doctor Near [city] Full Botox | Get $119 Botox Doctor Near [region] Full Botox,22,backend/runs/2025-10-21_40libs/
Local Loads for Pickup Trucks 🚚 Got a pickup?,available loads [for pickup trucks] (near my zipcode) | available loads [for pickup trucks] nearby | see available loads [for pickup trucks] (near my zipcode) | find available loads [for pickup trucks] (near my zipcode) | find available loads [for pickup trucks] nearby,23,backend/runs/2025-10-21_40libs/
"Grand Cherokee From $100/Month 🚙 Yes, 2024 Grand Cherokees are going for just $100/month—see where this deal is available near you.",$100/month - grand cherokee 2024 suvs nearby | $100/month grand cherokee 2024 suvs nearby | $100/month - grand cherokee 2024 suvs near me | $100/month - grand cherokee 2024 suv nearby | $100/month - grand cherokee 2025 suvs nearby,9,backend/runs/2025-10-21_40libs/
"Ford F-150 from $100/Month 🛻 Yes, you can drive a brand-new 2024 Ford F-150 for just $100/month—find out where it’s available near you.",$100/month - Ford F-150 2024 Nearby | $100/month Ford F-150 2024 Nearby | $100/month - Ford F-150 2024 Near me | $100/month - Ford F-150 2025 Nearby | $100/month - Ford F-150 2024 Near [city],11,backend/runs/2025-10-21_40libs/
Dodge RAM Only $100/Month This Dodge RAM deal is stirring up serious attention—don’t miss it.,$100/month - dodge ram 2024 nearby | $100/month - dodge ram 2024 near me | $100/month dodge ram 2024 nearby | see $100/month - dodge ram 2024 nearby | find $100/month - dodge ram 2024 nearby,14,backend/runs/2025-10-21_40libs/
Casas FHA: $100 Abajo 💸 Posee una casa con solo $ 100 abajo!,fha $100 dollar down payment program | fha $100 dollar down payment program near [city] | fha $100 dollar down payment program near me | fha $100 dollar down payment program nearby | fha $100 dollar down payment program in [region],22,backend/runs/2025-10-21_40libs/
Laser Eye Surgery $299 👀 Laser eye surgery starting at just $299?,$299 laser eye surgery near me | see $299 laser eye surgery near me | find $299 laser eye surgery near me | discover $299 laser eye surgery near me | $299 laser eye surgery,16,backend/runs/2025-10-21_40libs/
Full Botox for $119 Full Botox treatment for just $119?,Get $119 Botox Doctor Near Me Full Botox | $119 Botox Doctor Near Me Full Botox | Get $119 Botox Doctor Nearby Full Botox | Get $119 Botox Doctor Near [city] Full Botox | Get $119 Botox Doctor Near [region] Full Botox,8,backend/runs/2025-10-21_40libs/
FHA Homes: $100 Down 💸 Own a home with just $100 down!,fha $100 dollar down payment program | fha $100 dollar down payment program near [city] | fha $100 dollar down payment program near me | fha $100 dollar down payment program nearby | fha $100 dollar down payment program in [region],12,backend/runs/2025-10-21_40libs/
Botox Completo por $119 Tratamiento completo de Botox por solo $119—rejuvenece tu rostro sin pagar de más.,get $119 botox doctor near me full botox | $119 botox doctor near me full botox | get $119 botox doctor nearby full botox | Get $119 Botox Doctor Near [city] Full Botox | Get $119 Botox Doctor Near [region] Full Botox,4,backend/runs/2025-10-21_40libs/
"Mejores SUVs para Personas Mayores 🚗 Estos SUVs pequeños son cómodos, seguros y accesibles—ideales para personas mayores que saben aprovechar su dinero.",best small suv for seniors 2025 | find best small suv for seniors 2025 | see best small suv for seniors 2025 | best small suvs for seniors 2025 | 2025 best small suv for seniors 2025,7,backend/runs/2025-10-21_40libs/
Gov-Funded Medical Courses Work from home in healthcare 💻🔥 Training costs?,gov-funded medical billing courses | gov funded medical billing courses | government-funded medical billing courses | see gov-funded medical billing courses | find gov-funded medical billing courses,4,backend/runs/2025-10-21_40libs/
{{product.,$100/month - dodge ram 2024 nearby | $100/month - dodge ram 2024 near me | $100/month dodge ram 2024 nearby | see $100/month - dodge ram 2024 nearby | find $100/month - dodge ram 2024 nearby,4,backend/runs/2025-10-21_40libs/
$100/Mo Dodge RAM This Dodge RAM deal is stirring up serious attention—don’t miss it.,$100/month - dodge ram 2024 nearby | $100/month - dodge ram 2024 near me | $100/month dodge ram 2024 nearby | see $100/month - dodge ram 2024 nearby | find $100/month - dodge ram 2024 nearby,11,backend/runs/2025-10-21_40libs/
$100/Month RAM You won’t believe what you can drive for just $100/month.,$100/month - dodge ram 2024 nearby | $100/month - dodge ram 2024 near me | $100/month dodge ram 2024 nearby | see $100/month - dodge ram 2024 nearby | find $100/month - dodge ram 2024 nearby,1,backend/runs/2025-10-21_40libs/
Dodge RAM solo $100/mes Este trato de Dodge RAM está despertando una seria atención-no te lo pierdas.,$100/month - dodge ram 2024 nearby | $100/month - dodge ram 2024 near me | $100/month dodge ram 2024 nearby | see $100/month - dodge ram 2024 nearby | find $100/month - dodge ram 2024 nearby,4,backend/runs/2025-10-21_40libs/
Repossessed Deals You’ll Love 😱 Luxury cars for under $10K?,Cheap Repossessed Cars Nearby | bank repossessed cars nearby | Cash Cars Near Me Under 10k | Cheap Repossessed Cars near me Under $10k | Repossessed Cars for sale near me Under $10k,1,backend/runs/2025-10-21_40libs/
