hook,forcekeys,unique_ad_count,run_dir
Viviendas para Adultos Mayores Desde $499/mes 🏡 🏡 Descubre comunidades para mayores de 55 años desde solo $499 al mes—comodidad asequible sin compromisos.,$499/mo 55 and Older Apartments Near Me | $499/mo Senior Living | $499/mo 55 and Older Apartments in [city] | $499/mo 55 and Older Apartments in [region] | $499/mo 55  Apartments,3,backend/runs/2025-10-21_3pages_retry/
Seniors: Get $10/Mo Internet 💸 Internet for $10?,$10 Internet Providers in My Zip Code | find $10 Internet Providers in My Zip Code | see $10 Internet Providers in My Zip Code | $10 Internet Provider in My Zip Code | get $10 Internet Providers in My Zip Code,2,backend/runs/2025-10-21_3pages_retry/
Senior Living From $499/Month 🏡 🏡 Discover 55+ senior living communities starting at just $499/month—affordable comfort without compromise.,$499/mo 55 and Older Apartments Near Me | $499/mo Senior Living | $499/mo 55 and Older Apartments in [city] | $499/mo 55 and Older Apartments in [region] | $499/mo 55  Apartments,3,backend/runs/2025-10-21_3pages_retry/
Drive your new truck with zero down Drive your dream truck today!,100 accepted 0 down options new f150 and ram trucks near me [at no cost] apply now | find 100 accepted 0 down options new f150 and ram trucks near me [at no cost] apply now | 100 accepted 0 down options new f150 and ram trucks near me [at no cost] apply now near you | get 100 accepted 0 down options new f150 and ram trucks near me [at no cost] apply now | apply for 100 accepted 0 down options new f150 and ram trucks near me [at no cost] apply now,2,backend/runs/2025-10-21_3pages_retry/
¡Solo $249 al mes por vivienda para mayores!,best senior living options for $249/mo | senior living options for $249/mo | find senior living options for $249/mo | best senior living options for $249/month | senior living options for $249/month,2,backend/runs/2025-10-21_3pages_retry/
Juvederm treatments at surprisingly low prices Smooth out wrinkles and restore volume — Juvederm treatments are more affordable than ever.,juvéderm clinics near me | find juvéderm clinics near me | see juvéderm clinics near me | must-see juvéderm clinics near me | must see juvéderm clinics near me,3,backend/runs/2025-10-21_3pages_retry/
Get paid to learn — start driving today Get paid while you train!,pickup driver career | find pickup driver career | pickup driver career near you | start pickup driver career | apply for pickup driver career,1,backend/runs/2025-10-21_3pages_retry/
Take back your independence today Regain your freedom with a Medicare-covered mobility scooter — no out-of-pocket costs for those who qualify.,applying for medicare-covered mobility scooters asap - 100 coverage | apply for medicare-covered mobility scooters asap - 100 coverage | find applying for medicare-covered mobility scooters asap - 100 coverage | applying for medicare-covered mobility scooters asap - 100 coverage near you | get applying for medicare-covered mobility scooters asap - 100 coverage,3,backend/runs/2025-10-21_3pages_retry/
Grand Cherokee From $100/Month Don’t miss this: Grand Cherokee SUV deals starting at just $100/month—available now in your area.,$100/month ‐ Grand Cherokee 2024 Suvs Nearby | $100/month Grand Cherokee 2024 Suvs Nearby | $100/month ‐ Grand Cherokee 2024 Suvs Near me | $100/month ‐ Grand Cherokee 2024 Suv Nearby | $100/month ‐ Grand Cherokee 2025 Suvs Nearby,3,backend/runs/2025-10-21_3pages_retry/
Medications Linked to Atrial Fibrillation 💊 New research reveals medications linked to atrial fibrillation—see which drugs could increase your risk.,paroxysmal atrial fibrillation anticoagulation | atrial fibrillation medications | anticoagulation in elderly patients with atrial fibrillation | symptoms of atrial fibrillation in elderly | early detection of atrial fibrillation,2,backend/runs/2025-10-21_3pages_retry/
Talk to a Local Immigration Lawyer 🌎 Need immigration assistance?,Immigration attorneys in Los Angeles | Immigration attorney in California | Find an immigration lawyer | Get an immigration lawyer quickly | Find immigration lawyer in my area,2,backend/runs/2025-10-21_3pages_retry/
Get Your Permanent Dental Implants NOW – 100% FREE!,,26,backend/runs/2025-10-21_3pages_retry/
👉 Check If You Qualify for Free Fat Removal Today!,,2,backend/runs/2025-10-21_3pages_retry/
"$4,000 for Doing Almost Nothing – Sleep Apnea Trial Paying NOW!",,11,backend/runs/2025-10-21_3pages_retry/
Affordable Botox Treatments Smooth your look without overspending.,,3,backend/runs/2025-10-21_3pages_retry/
"Earn $1,500 + FREE Treatment—Join This Study TODAY!",,7,backend/runs/2025-10-21_3pages_retry/
💉 Botox From $3/Unit – Limited-Time Offer!,,5,backend/runs/2025-10-21_3pages_retry/
💥 FREE Dental Implants + Cash — See If You Qualify NOW!,,7,backend/runs/2025-10-21_3pages_retry/
"Neuropathy Patients Wanted – $3,000 Reward 💰 Researchers are looking for neuropathy trial participants right now.",,3,backend/runs/2025-10-21_3pages_retry/
Compra tu Casa con Dinero Gratis: Descubre Cómo ¿Quieres comprar una casa pero no tienes dinero?,Help me get a house | Assist me in getting a house | Help me get a house in {city} | Help me get a house in 2025 | Help me get a house in {region} by 2025,8,backend/runs/2025-10-21_3pages_widget/
$249/Month Senior Living!,Senior Living Options for $249/month | see Senior Living Options for $249/month | find Senior Living Options for $249/month | must see Senior Living Options for $249/month | must-see Senior Living Options for $249/month,25,backend/runs/2025-10-21_3pages_widget/
Tree Removal for Just $49 – See If You Qualify!,tree cutting service for $49 near my zipcode | tree cutting services for $49 near my zipcode | tree cutting service near my zipcode for $49 | tree cutting services near my zipcode for $49 | tree cutting service for $49 near me,7,backend/runs/2025-10-21_3pages_widget/
Botox completo solo $119 Luce radiante con Botox completo por solo $119—la belleza gana aquí everydaysolutions.,get $119 botox doctor near me full botox | $119 botox doctor near me full botox | get $119 botox doctor nearby full botox | Get $119 Botox Doctor Near [city] Full Botox | Get $119 Botox Doctor Near [region] Full Botox,12,backend/runs/2025-10-21_3pages_widget/
Botox completo solo $119 Luce radiante con Botox completo por solo $119—la belleza gana aquí everydaysolutions.,Get $119 Botox Doctor Near Me Full Botox | $119 Botox Doctor Near Me Full Botox | Get $119 Botox Doctor Nearby Full Botox | Get $119 Botox Doctor Near [city] Full Botox | Get $119 Botox Doctor Near [region] Full Botox,11,backend/runs/2025-10-21_3pages_widget/
Teléfonos Gratis para Adultos Mayores Celulares económicos y fáciles de usar esperan por los adultos mayores.,discounted senior phone plans | get discounted senior phone plans | discounted phones for seniors 60 and older | discounted phones for seniors 60 | best discounted senior phone plans,39,backend/runs/2025-10-21_3pages_widget/
Comunidades para adultos mayores que están dando de qué hablar en 2025 ¿Estás pensando en mudarte?,55 plus apartments | 55 and older apartments | new 55 plus communities | 55 plus new construction | homes for 55 and older,4,backend/runs/2025-10-21_3pages_widget/
🛻 GMC Sierra Under $10k Deal!,gmc sierra 1500 clearance sale - see [region] prices | see gmc sierra 1500 clearance sale - see [region] prices | find gmc sierra 1500 clearance sale - see [region] prices | gmc sierra 1500 clearance sales - see [region] prices | see gmc sierra 1500 clearance sales - see [region] prices,3,backend/runs/2025-10-21_3pages_widget/
Dinero Gratis Para Comprar Casa — ¡Revisa Aquí!,Assist Me in Getting a House | Help Me Get a House in [state] by 2025 | Assist Me in Getting a House by 2025 | Help Me Get a House in [state] in 2025 | Assist Me in Getting a House in 2025,11,backend/runs/2025-10-21_3pages_widget/
Full Botox Treatment — Only $119!,get $119 botox doctor near me full botox | $119 botox doctor near me full botox | see $119 botox doctor near me full botox | find $119 botox doctor near me full botox | must-see $119 botox doctor near me full botox,14,backend/runs/2025-10-21_3pages_widget/
🚀 Govt-Funded LPN Training 📚 Train as an Licensed Nurse Practitioner — 100% government-funded!,3 weeks lpn online course {region_code} approved | become an lpn in 3 weeks {region_code} approved | government-funded lpn education | 3 weeks lpn online course {city} approved | become an lpn in 3 weeks {city} approved,4,backend/runs/2025-10-21_3pages_widget/
Botox completo solo $149 Obtener brillante con Botox completo en solo $ 149-belleza gana aquí 💉 https://everydaysolutions.,Get $149 Botox Doctor Near Me Full Botox | $149 Botox Doctor Near Me Full Botox | Get $149 Botox Doctor Nearby Full Botox | Get $149 Botox Doctor Near [city] Full Botox | Get $149 Botox Doctor Near [region] Full Botox,4,backend/runs/2025-10-21_3pages_widget/
Full Botox Only $119 Get glowing with full Botox at just $119—beauty wins here 💉 everydaysolutions.,Get $119 Botox Doctor Near Me Full Botox | $119 Botox Doctor Near Me Full Botox | Get $119 Botox Doctor Nearby Full Botox | Get $119 Botox Doctor Near [city] Full Botox | Get $119 Botox Doctor Near [region] Full Botox,3,backend/runs/2025-10-21_3pages_widget/
Everyday Solutions III Get glowing with full Botox at just $119—beauty wins here 💉 everydaysolutions.,Get $119 Botox Doctor Near Me Full Botox | $119 Botox Doctor Near Me Full Botox | Get $119 Botox Doctor Nearby Full Botox | Get $119 Botox Doctor Near [city] Full Botox | Get $119 Botox Doctor Near [region] Full Botox,2,backend/runs/2025-10-21_3pages_widget/
{{product.,Get $119 Botox Doctor Near Me Full Botox | $119 Botox Doctor Near Me Full Botox | Get $119 Botox Doctor Nearby Full Botox | Get $119 Botox Doctor Near [city] Full Botox | Get $119 Botox Doctor Near [region] Full Botox,4,backend/runs/2025-10-21_3pages_widget/
Rent Limited to 30 Percent 🏠 Rent capped at just 30% of your income?,55 and older apartments near me | see 55 and older apartments near me | find 55 and older apartments near me | 55 and older apartment near me | discover 55 and older apartments near me,3,backend/runs/2025-10-21_3pages_widget/
Low Cost Pet Insurance For Seniors 🐾 💸 Love your furry friend?,pet insurance quotes | pet insurance quotes ($10/month) | pet insurance for dogs ($10/month) | pet insurance for dogs | 2024 pet insurance quotes ($10/month),8,backend/runs/2025-10-21_3pages_widget/
🏠 Casas Sin Enganche Cerca de Ti ¿Sueñas con tener casa propia pero te preocupa el enganche?,i want to buy a house with no money | i want to buy a home with no money | how to buy a house with no money | discover how to buy a house with no money | see how to buy a house with no money,5,backend/runs/2025-10-21_3pages_widget/
$299 LASIK Near You 👓 Just found $299 LASIK in my area—clear vision doesn’t have to cost thousands!,$299 laser eye surgery near me | see $299 laser eye surgery near me | find $299 laser eye surgery near me | discover $299 laser eye surgery near me | $299 laser eye surgery,4,backend/runs/2025-10-21_3pages_widget/
Google Phone Now $0?,Order New Phone 5g ($0 Google Pixel Pro Fold) | Order New Phone and Plan ($0 New Smartphone) | Order $0 New Phone 5g (Google Pixel Pro Fold) | Order New Smartphone 5g ($0 Google Pixel Pro Fold) | Order New Smartphone and Plan ($0 New Phone),6,backend/runs/2025-10-21_3pages_widget/
Get Your Permanent Dental Implants NOW – 100% FREE!,,26,backend/runs/2025-10-21_3pages_widget/
👉 Check If You Qualify for Free Fat Removal Today!,,2,backend/runs/2025-10-21_3pages_widget/
"$4,000 for Doing Almost Nothing – Sleep Apnea Trial Paying NOW!",,11,backend/runs/2025-10-21_3pages_widget/
Affordable Botox Treatments Smooth your look without overspending.,,3,backend/runs/2025-10-21_3pages_widget/
"Earn $1,500 + FREE Treatment—Join This Study TODAY!",,7,backend/runs/2025-10-21_3pages_widget/
💉 Botox From $3/Unit – Limited-Time Offer!,,5,backend/runs/2025-10-21_3pages_widget/
💥 FREE Dental Implants + Cash — See If You Qualify NOW!,,7,backend/runs/2025-10-21_3pages_widget/
"Neuropathy Patients Wanted – $3,000 Reward 💰 Researchers are looking for neuropathy trial participants right now.",,3,backend/runs/2025-10-21_3pages_widget/
"The Smart Rollator That’s Changing Senior Mobility 🚶‍♂️💡 Discover the high-tech upgrade to traditional walkers—designed for safety, comfort, and independence.",,8,backend/runs/2025-10-21_40libs/
Old Pennies Could Be Worth Thousands 🧠 Learn how to spot valuable coins before they vanish from circulation 👀 budgetdetails.,,7,backend/runs/2025-10-21_40libs/
How to Get Dental Implants This is how I was able to get dental implants without having to spend thousands of dollars⬇️ **Not all qualify for this program.,,8,backend/runs/2025-10-21_40libs/
See How to Qualify This is such a cool update for those who need dental implants.,,12,backend/runs/2025-10-21_40libs/
Cómo Conseguir Internet Sin Costo Así fue como conseguí un plan de internet más barato ⬇️ Se aplican requisitos de elegibilidad.,,2,backend/runs/2025-10-21_40libs/
How to Get No Cost Internet This is how I got a more affordable internet plan ⬇️ **Eligibility requirements apply.,,8,backend/runs/2025-10-21_40libs/
Cómo Obtener Internet Sin Costo Esto está padrísimo para los adultos mayores.,,5,backend/runs/2025-10-21_40libs/
Cómo Obtener Internet Sin Costo Así fue como conseguí internet sin pagar nada ⬇️ *No todos califican para este programa.,,1,backend/runs/2025-10-21_40libs/
See How to Get No Cost Internet This is such a cool update for seniors.,,3,backend/runs/2025-10-21_40libs/
See How to Qualify This is such a cool update for seniors.,,4,backend/runs/2025-10-21_40libs/
How To Get Bank Account Bonuses Check Out Banks That Offer Up To $1000 For Opening a New Account!,,6,backend/runs/2025-10-21_40libs/
See Banks Offering Sign Up Bonuses: Check Out Banks That Offer Up To $1000 For Opening a New Account!,,6,backend/runs/2025-10-21_40libs/
Caregiver Jobs Available Immediate Openings: Caregiver Jobs with Great Benefits.,,2,backend/runs/2025-10-21_40libs/
Free Dental Implants?,,1,backend/runs/2025-10-21_40libs/
Become an Egg Donor Get Paid to Donate Eggs.,,1,backend/runs/2025-10-21_40libs/
"Paid Phlebotomist Training Online The Fastest Way to Become a Certified Phlebotomist in 2025 No experience required, no upfront costs, and open to everyone!",,1,backend/runs/2025-10-21_40libs/
Essential Info on Autism Housing Assistance Grants 💡🧩 Discover the essentials of housing assistance grants for autism families!,,2,backend/runs/2025-10-21_40libs/
Discover Returned Amazon Items Learn how Returned Amazon Items Sale work and are sold.,,3,backend/runs/2025-10-21_40libs/
Exploring Smart Storage Rack Ideas Discover how storage rack solutions can simplify organization in every room.,,1,backend/runs/2025-10-21_40libs/
Explore Top Tier Education in Canada Learn how studying in Canada provides diverse programs and cultural experiences.,,1,backend/runs/2025-10-21_40libs/
Exploring Modern Cooking Appliances Learn how cooking appliances can transform everyday meal preparation with practical kitchen solutions.,,1,backend/runs/2025-10-21_40libs/
Innovative Dental Clips for Teeth Care Learn how dental clips support teeth alignment and improve oral aesthetics.,,1,backend/runs/2025-10-21_40libs/
Guide to Storage Rack Solutions Discover how storage rack solutions can simplify organization in every room.,,2,backend/runs/2025-10-21_40libs/
Pay Monthly iPhone 17 Guide Discover how monthly iPhone 17 plans help spread payments over time.,,2,backend/runs/2025-10-21_40libs/
How Robot Vacuum Payment Plans Work Learn how monthly robot vacuum plans can make home cleaning effortless.,,3,backend/runs/2025-10-21_40libs/
Explore Essential Cooking Appliances Guide Learn how different cooking appliances can enhance your meals and kitchen experience.,,1,backend/runs/2025-10-21_40libs/
Learn How Payroll Accounting Skills Are Built Explore practical payroll training designed to strengthen accounting knowledge and technical skills.,,3,backend/runs/2025-10-21_40libs/
How Backyard Apartments Add Property Value Learn how backyard apartments can enhance housing flexibility and property value.,,3,backend/runs/2025-10-21_40libs/
Best Dtf Printers For Small Businesses A helpful guide on choosing DTF printers for custom printing.,,1,backend/runs/2025-10-21_40libs/
"Exploring Home Storage Ideas Learn how storage rack solutions help organize kitchens, bathrooms, and bedrooms.",,3,backend/runs/2025-10-21_40libs/
Guide to Amazon Flex Delivery Learn how Amazon Flex delivery careers provide flexibility and independence for drivers.,,3,backend/runs/2025-10-21_40libs/
Guide to Laser Spider Vein Removal Learn how laser treatment reduces spider veins while supporting smoother looking skin.,,3,backend/runs/2025-10-21_40libs/
Guide to Belly Fat Removal Discover different approaches to belly fat removal and their considerations.,,1,backend/runs/2025-10-21_40libs/
Study Scholarships in Italy Guide Learn how international students access study support programs across Italy.,,1,backend/runs/2025-10-21_40libs/
Unveiling 2025's Top Online Scams: Learn How to Stay Safe Find out how to protect yourself from 2025's top online scams and stay informed.,,1,backend/runs/2025-10-21_40libs/
Conheça os Resorts All Inclusive Mais Cobiçados do Brasil Descubra como escolher o resort perfeito para suas férias com tudo incluso.,,1,backend/runs/2025-10-21_40libs/
Unveiling the Future of Mental Health Tools in 2025 Explore the transformative mental wellness tools of 2025.,,1,backend/runs/2025-10-21_40libs/
Uncover Virtual Reality's Role in Mental Health Discover groundbreaking mental wellness tools transforming stress and anxiety management in 2025.,,1,backend/runs/2025-10-21_40libs/
Discover 2025's Trending Netflix Shows Capturing Audiences Discover what's trending on Netflix this year and why these shows are captivating audiences worldwide.,,1,backend/runs/2025-10-21_40libs/
"Explore Trending Driveway Designs and Innovations of 2025 Discover why resin-bound surfaces are gaining popularity for their sleek, low-maintenance appeal.",,1,backend/runs/2025-10-21_40libs/
Discover Cost-Effective Alternatives to Dental Implants Explore a range of dental implant alternatives and find out which option suits your needs best.,,1,backend/runs/2025-10-21_40libs/
Essential Guide to Handling Medical Malpractice Situations Protect your rights in a malpractice case by learning the necessary steps and legal considerations.,,1,backend/runs/2025-10-21_40libs/
Find Out How to Protect Your Rights in Malpractice Cases Find out how to navigate the complexities of a medical malpractice case with informed decisions.,,1,backend/runs/2025-10-21_40libs/
"Mycosis Fungoides: Discover Symptoms and Treatment Options Learn about Mycosis Fungoides, a rare skin lymphoma.",,1,backend/runs/2025-10-21_40libs/
Explore Key Insights on Preparing for and Recovering from Knee Surgery Explore how to get ready for knee surgery and understand the recovery process.,,1,backend/runs/2025-10-21_40libs/
Explore Key Insights on Preparing for and Recovering from Knee Surgery Learn about knee surgery preparation and recovery to ensure optimal outcomes.,,1,backend/runs/2025-10-21_40libs/
Triple Negative Breast Cancer: Discover Causes and Treatments Uncover the challenges and care strategies in treating Triple Negative Breast Cancer.,,1,backend/runs/2025-10-21_40libs/
"Triple Negative Breast Cancer: Discover Causes and Treatments Find out the complexities of Triple Negative Breast Cancer, including its causes and emerging care strategies.",,1,backend/runs/2025-10-21_40libs/
Delving into Triple Negative Breast Cancer: Risks and Treatments Discover the risks and treatments associated with Triple Negative Breast Cancer for better patient outcomes.,,1,backend/runs/2025-10-21_40libs/
Exploring the Complexities of Triple Negative Breast Cancer Discover the risks and treatments associated with Triple Negative Breast Cancer for better patient outcomes.,,1,backend/runs/2025-10-21_40libs/
Understanding Hormone Blockers in Breast Cancer Therapy Explore the impact of hormone blockers on breast cancer patient survival rates.,,1,backend/runs/2025-10-21_40libs/
Unveiling Polymyalgia Rheumatica: Recognizing Symptoms & Care Learn about PMR symptoms and treatments to enhance understanding and improve care.,,1,backend/runs/2025-10-21_40libs/
Exploring Polymyalgia Rheumatica: Symptoms and Treatment Insights Find out how to identify PMR symptoms and explore treatment options for better management.,,1,backend/runs/2025-10-21_40libs/
Uncover the Role of Lighting in Enhancing Front Door Appeal Vibrant front door colors like electric blue and ruby are making homes pop.,,1,backend/runs/2025-10-21_40libs/
Explore New Innovations in Dry Eye Treatments for 2025 Learn about new therapies for dry eyes and find out how they promise improved relief and eye health.,,1,backend/runs/2025-10-21_40libs/
Explore 2025's Best Small SUVs for Senior Safety & Comfort Learn which small SUVs provide the best safety and comfort features for seniors in 2025.,,1,backend/runs/2025-10-21_40libs/
Uncover Exciting Activities to Strengthen Your Bond Learn how exploring a new hobby together can reignite your relationship spark.,,1,backend/runs/2025-10-21_40libs/
"Navigating Chronic Fatigue Syndrome: Symptoms, Causes, and More Understand the symptoms of ME/CFS and find out how it affects people differently.",,1,backend/runs/2025-10-21_40libs/
Cancún con todo incluído: guía para elegir el hotel ideal para tus vacaciones Aprende a elegir el hotel perfecto en Cancún sin gastar más de lo necesario.,,1,backend/runs/2025-10-21_40libs/
Exploring the Flexibility of Destination Trailers for Families Find out why destination trailers provide a home-like vacation experience for families.,,1,backend/runs/2025-10-21_40libs/
Unveiling the Fat-Burning Potential of Homemade Drinks Learn about homemade drinks that may promote fat burning and support a balanced lifestyle.,,1,backend/runs/2025-10-21_40libs/
Understanding Leg Blood Clots: Key Symptoms & Prevention Learn the symptoms of leg blood clots and how to prevent them for better health.,,1,backend/runs/2025-10-21_40libs/
Essential Early Symptoms of Pancreatic Cancer to Watch For Learn how to spot early signs of pancreatic cancer to improve health outcomes.,,1,backend/runs/2025-10-21_40libs/
Learn About Financial Aspects of Retirement Villages Discover the legal framework that protects residents' rights in retirement villages for informed living.,,1,backend/runs/2025-10-21_40libs/
Discover the Benefits of Retirement Villages for Seniors Discover the legal framework that protects residents' rights in retirement villages for informed living.,,1,backend/runs/2025-10-21_40libs/
"Explore the Intriguing World of Adult-Only Hotels and Resorts Discover the allure of adult-only resorts, offering unique experiences beyond relaxation and luxury.",,1,backend/runs/2025-10-21_40libs/
Spice Up Your Quality Time: 10 Fun Adult-Only Ideas for You and Your Partner glam1st.,,1,backend/runs/2025-10-21_40libs/
Insights into Breast Cancer: Exploring Risks and Care for Women Over 70 topics1st.,,1,backend/runs/2025-10-21_40libs/
Do You Know The Benefits of Dental Implant Trials?,,1,backend/runs/2025-10-21_40libs/
Uncover the Benefits of Joining Dental Implant Clinical Trials Find out how dental implant clinical trials enhance safety and innovation.,,1,backend/runs/2025-10-21_40libs/
"Exploring the All-New 2025 Ford F150: Features, Design, and Performance Insights discover1st.",,1,backend/runs/2025-10-21_40libs/
Hyundai Has Done It Again The Palisade's interior is more than meets the eye.,,1,backend/runs/2025-10-21_40libs/
Hyundai Palisade: What's Inside That Makes It a Must-Know The Palisade's interior is more than meets the eye.,,1,backend/runs/2025-10-21_40libs/
Learn About Nutrient-Rich Foods for Thyroid Wellness Find out how wild-caught fish provides omega-3s and iodine for thyroid support.,,1,backend/runs/2025-10-21_40libs/
What Is The Best Psoriasis Shampoo?,,1,backend/runs/2025-10-21_40libs/
Learn Effective Tips for Managing Swollen Feet at Home Uncover practical home strategies for alleviating swollen feet.,,1,backend/runs/2025-10-21_40libs/
Effective Home Strategies for Swollen Feet Management Learn how to manage swollen feet at home with simple strategies.,,1,backend/runs/2025-10-21_40libs/
"Explore How Foldable Beds Are Transforming Urban Living Find out why foldable beds are a popular choice for modern, space-conscious living.",,1,backend/runs/2025-10-21_40libs/
Exploring the Growing Trend of Foldable Beds discover1st.,,1,backend/runs/2025-10-21_40libs/
"Explore the Diverse Career Opportunities in Sonography Discover the essential training and career paths in sonography, a growing field in healthcare.",,1,backend/runs/2025-10-21_40libs/
"Uncover the Steps to a Rewarding Career in Sonography Discover the essential training and career paths in sonography, a growing field in healthcare.",,1,backend/runs/2025-10-21_40libs/
A Guide to Understanding Triple Negative Breast Cancer Discover how TNBC's unique biology impacts treatment and patient care strategies.,,1,backend/runs/2025-10-21_40libs/
The Hidden Truth About Hormone Blockers And Breast Cancer discover1st.,,1,backend/runs/2025-10-21_40libs/
A Comprehensive Guide to Identifying Psoriasis Symptoms Explore the visual indicators and symptoms of psoriasis for effective identification.,,1,backend/runs/2025-10-21_40libs/
A Guide to Experiencing Viking Cruises: What Travelers Have Learned Discover what makes Viking Cruises a preferred choice for travelers seeking comfort and culture.,,1,backend/runs/2025-10-21_40libs/
