hook,forcekeys,unique_ad_count,run_dir
Ram 2024 por $100/Mes La Dodge Ram 2024 está aquí por solo $100 al mes.,$100/month - Dodge Ram 2024 Nearby | $100/month - Dodge Ram 2024 Near Me | $100/month Dodge Ram 2024 Nearby | See $100/month - Dodge Ram 2024 Nearby | Find $100/month - Dodge Ram 2024 Nearby,3,backend/runs/2025-10-21_3pages_headless/
"$99 Laser Skin Rejuvenation Get fresh, rejuvenated skin with laser treatments.",Laser skin rejuvenation [city] | Laser skin rejuvenation in [city] | Facial Laser Rejuvenation Treatment | Face Rejuvenation Laser Treatment | Facial Laser Treatment,27,backend/runs/2025-10-21_3pages_headless/
$99 Laser Skin Rejuvenation Rejuvenate Your Skin!,Laser skin rejuvenation [city] | Laser skin rejuvenation in [city] | Facial Laser Rejuvenation Treatment | Face Rejuvenation Laser Treatment | Facial Laser Treatment,1,backend/runs/2025-10-21_3pages_headless/
"Budget-Friendly 55+ Apartments Revealed Discover hidden affordable apartment options designed for those 55+, with benefits you might not expect.",55 and older apartments near me | see 55 and older apartments near me | find 55 and older apartments near me | 55 and older apartment near me | discover 55 and older apartments near me,14,backend/runs/2025-10-21_3pages_headless/
Comidas Gratis a Domicilio para Adultos Mayores 🥗 Los adultos mayores pueden calificar para recibir comidas nutritivas gratis directamente en su puerta—descubre hoy si tú o un ser,home delivered meals for seniors no cost | $0 meal delivery | free home delivered meals for seniors near me | free home delivered meals for seniors | $0 meal delivery in [city],4,backend/runs/2025-10-21_3pages_headless/
Dinero Gratis Para Baños Desbloquea subvenciones secretas para renovar tu elegibilidad de verificación de baño ahora.,bathroom remodel paid by grants [region] | bathroom remodel paid by grants  | get bathroom remodel paid by grants  | find bathroom remodel paid by grants  | bathroom remodel paid for by grants ,7,backend/runs/2025-10-21_3pages_headless/
{{product.,Laser skin rejuvenation [city] | Laser skin rejuvenation in [city] | Facial Laser Rejuvenation Treatment | Face Rejuvenation Laser Treatment | Facial Laser Treatment,2,backend/runs/2025-10-21_3pages_headless/
Seniors Under 85 Can Own a GMC Sierra for Less Than $10K!,gmc sierra 1500 clearance sale - see [region] prices | see gmc sierra 1500 clearance sale - see [region] prices | find gmc sierra 1500 clearance sale - see [region] prices | must-see gmc sierra 1500 clearance sale - see [region] prices | must see gmc sierra 1500 clearance sale - see [region]prices,1,backend/runs/2025-10-21_3pages_headless/
Senior Living for $249!,best senior living options for $249/mo | senior living options for $249/mo | find senior living options for $249/mo | best senior living options for $249/month | senior living options for $249/month,29,backend/runs/2025-10-21_3pages_headless/
Tree Cutting From $9 Near You 🌳 Tree removal starting at just $9—see if your ZIP qualifies today.,$9 tree cutting service (near my zipcode) | find $9 tree cutting service (near my zipcode) | discover $9 tree cutting service (near my zipcode) | $9 tree cutting service near me | $9 tree cutting service nearby,15,backend/runs/2025-10-21_3pages_headless/
{{product.,$9 tree cutting service (near my zipcode) | find $9 tree cutting service (near my zipcode) | discover $9 tree cutting service (near my zipcode) | $9 tree cutting service near me | $9 tree cutting service nearby,5,backend/runs/2025-10-21_3pages_headless/
Obtén dinero gratis para comprar una casa ¿Necesitas una casa?,Help me get a house | Assist me in getting a house | Help me get a house in {city} | Help me get a house in 2025 | Help me get a house in {region} by 2025,4,backend/runs/2025-10-21_3pages_headless/
Seniors: Rent Starts Low Senior apartments for just $499/month?,499/mo 55 and older apartments near me [state] | 499/mo 55 and older apartments nearby | 499/mo 55 and older apartments near me | see 499/mo 55 and older apartments | find 499/mo 55 and older apartments,10,backend/runs/2025-10-21_3pages_headless/
"Laser Skin Rejuvenation Without Breaking Bank Get fresh, rejuvenated skin with laser treatments.",Laser skin rejuvenation [city] | Laser skin rejuvenation in [city] | Facial Laser Rejuvenation Treatment | Face Rejuvenation Laser Treatment | Facial Laser Treatment,2,backend/runs/2025-10-21_3pages_headless/
"Free Meals for Seniors Delivered 🥗 Seniors may qualify for free, nutritious meals delivered right to their doorstep—see if you or a loved one are eligible today.",home delivered meals for seniors no cost | $0 meal delivery | free home delivered meals for seniors near me | free home delivered meals for seniors | free home delivered meals for seniors in [city],4,backend/runs/2025-10-21_3pages_headless/
Internet desde $10 Proveedores de internet desde $10 ya disponibles en tu zona.,$10 Internet Providers in My Zip Code | find $10 Internet Providers in My Zip Code | see $10 Internet Providers in My Zip Code | $10 Internet Provider in My Zip Code | get $10 Internet Providers in My Zip Code,1,backend/runs/2025-10-21_3pages_headless/
Get Your Permanent Dental Implants NOW – 100% FREE!,,26,backend/runs/2025-10-21_3pages_headless/
👉 Check If You Qualify for Free Fat Removal Today!,,2,backend/runs/2025-10-21_3pages_headless/
"$4,000 for Doing Almost Nothing – Sleep Apnea Trial Paying NOW!",,11,backend/runs/2025-10-21_3pages_headless/
Affordable Botox Treatments Smooth your look without overspending.,,3,backend/runs/2025-10-21_3pages_headless/
"Earn $1,500 + FREE Treatment—Join This Study TODAY!",,7,backend/runs/2025-10-21_3pages_headless/
💉 Botox From $3/Unit – Limited-Time Offer!,,5,backend/runs/2025-10-21_3pages_headless/
💥 FREE Dental Implants + Cash — See If You Qualify NOW!,,7,backend/runs/2025-10-21_3pages_headless/
"Neuropathy Patients Wanted – $3,000 Reward 💰 Researchers are looking for neuropathy trial participants right now.",,3,backend/runs/2025-10-21_3pages_headless/
Compra tu Casa con Dinero Gratis: Descubre Cómo ¿Quieres comprar una casa pero no tienes dinero?,Help me get a house | Assist me in getting a house | Help me get a house in {city} | Help me get a house in 2025 | Help me get a house in {region} by 2025,8,backend/runs/2025-10-21_3pages_headless_click/
$249/Month Senior Living!,Senior Living Options for $249/month | see Senior Living Options for $249/month | find Senior Living Options for $249/month | must see Senior Living Options for $249/month | must-see Senior Living Options for $249/month,25,backend/runs/2025-10-21_3pages_headless_click/
Tree Removal for Just $49 – See If You Qualify!,tree cutting service for $49 near my zipcode | tree cutting services for $49 near my zipcode | tree cutting service near my zipcode for $49 | tree cutting services near my zipcode for $49 | tree cutting service for $49 near me,7,backend/runs/2025-10-21_3pages_headless_click/
Botox completo solo $119 Luce radiante con Botox completo por solo $119—la belleza gana aquí everydaysolutions.,get $119 botox doctor near me full botox | $119 botox doctor near me full botox | get $119 botox doctor nearby full botox | Get $119 Botox Doctor Near [city] Full Botox | Get $119 Botox Doctor Near [region] Full Botox,12,backend/runs/2025-10-21_3pages_headless_click/
Botox completo solo $119 Luce radiante con Botox completo por solo $119—la belleza gana aquí everydaysolutions.,Get $119 Botox Doctor Near Me Full Botox | $119 Botox Doctor Near Me Full Botox | Get $119 Botox Doctor Nearby Full Botox | Get $119 Botox Doctor Near [city] Full Botox | Get $119 Botox Doctor Near [region] Full Botox,11,backend/runs/2025-10-21_3pages_headless_click/
Teléfonos Gratis para Adultos Mayores Celulares económicos y fáciles de usar esperan por los adultos mayores.,discounted senior phone plans | get discounted senior phone plans | discounted phones for seniors 60 and older | discounted phones for seniors 60 | best discounted senior phone plans,39,backend/runs/2025-10-21_3pages_headless_click/
Comunidades para adultos mayores que están dando de qué hablar en 2025 ¿Estás pensando en mudarte?,55 plus apartments | 55 and older apartments | new 55 plus communities | 55 plus new construction | homes for 55 and older,4,backend/runs/2025-10-21_3pages_headless_click/
🛻 GMC Sierra Under $10k Deal!,gmc sierra 1500 clearance sale - see [region] prices | see gmc sierra 1500 clearance sale - see [region] prices | find gmc sierra 1500 clearance sale - see [region] prices | gmc sierra 1500 clearance sales - see [region] prices | see gmc sierra 1500 clearance sales - see [region] prices,3,backend/runs/2025-10-21_3pages_headless_click/
Dinero Gratis Para Comprar Casa — ¡Revisa Aquí!,Assist Me in Getting a House | Help Me Get a House in [state] by 2025 | Assist Me in Getting a House by 2025 | Help Me Get a House in [state] in 2025 | Assist Me in Getting a House in 2025,11,backend/runs/2025-10-21_3pages_headless_click/
Full Botox Treatment — Only $119!,get $119 botox doctor near me full botox | $119 botox doctor near me full botox | see $119 botox doctor near me full botox | find $119 botox doctor near me full botox | must-see $119 botox doctor near me full botox,14,backend/runs/2025-10-21_3pages_headless_click/
🚀 Govt-Funded LPN Training 📚 Train as an Licensed Nurse Practitioner — 100% government-funded!,3 weeks lpn online course {region_code} approved | become an lpn in 3 weeks {region_code} approved | government-funded lpn education | 3 weeks lpn online course {city} approved | become an lpn in 3 weeks {city} approved,4,backend/runs/2025-10-21_3pages_headless_click/
Botox completo solo $149 Obtener brillante con Botox completo en solo $ 149-belleza gana aquí 💉 https://everydaysolutions.,Get $149 Botox Doctor Near Me Full Botox | $149 Botox Doctor Near Me Full Botox | Get $149 Botox Doctor Nearby Full Botox | Get $149 Botox Doctor Near [city] Full Botox | Get $149 Botox Doctor Near [region] Full Botox,4,backend/runs/2025-10-21_3pages_headless_click/
Full Botox Only $119 Get glowing with full Botox at just $119—beauty wins here 💉 everydaysolutions.,Get $119 Botox Doctor Near Me Full Botox | $119 Botox Doctor Near Me Full Botox | Get $119 Botox Doctor Nearby Full Botox | Get $119 Botox Doctor Near [city] Full Botox | Get $119 Botox Doctor Near [region] Full Botox,3,backend/runs/2025-10-21_3pages_headless_click/
Everyday Solutions III Get glowing with full Botox at just $119—beauty wins here 💉 everydaysolutions.,Get $119 Botox Doctor Near Me Full Botox | $119 Botox Doctor Near Me Full Botox | Get $119 Botox Doctor Nearby Full Botox | Get $119 Botox Doctor Near [city] Full Botox | Get $119 Botox Doctor Near [region] Full Botox,2,backend/runs/2025-10-21_3pages_headless_click/
{{product.,Get $119 Botox Doctor Near Me Full Botox | $119 Botox Doctor Near Me Full Botox | Get $119 Botox Doctor Nearby Full Botox | Get $119 Botox Doctor Near [city] Full Botox | Get $119 Botox Doctor Near [region] Full Botox,4,backend/runs/2025-10-21_3pages_headless_click/
Rent Limited to 30 Percent 🏠 Rent capped at just 30% of your income?,55 and older apartments near me | see 55 and older apartments near me | find 55 and older apartments near me | 55 and older apartment near me | discover 55 and older apartments near me,3,backend/runs/2025-10-21_3pages_headless_click/
Low Cost Pet Insurance For Seniors 🐾 💸 Love your furry friend?,pet insurance quotes | pet insurance quotes ($10/month) | pet insurance for dogs ($10/month) | pet insurance for dogs | 2024 pet insurance quotes ($10/month),8,backend/runs/2025-10-21_3pages_headless_click/
🏠 Casas Sin Enganche Cerca de Ti ¿Sueñas con tener casa propia pero te preocupa el enganche?,i want to buy a house with no money | i want to buy a home with no money | how to buy a house with no money | discover how to buy a house with no money | see how to buy a house with no money,5,backend/runs/2025-10-21_3pages_headless_click/
$299 LASIK Near You 👓 Just found $299 LASIK in my area—clear vision doesn’t have to cost thousands!,$299 laser eye surgery near me | see $299 laser eye surgery near me | find $299 laser eye surgery near me | discover $299 laser eye surgery near me | $299 laser eye surgery,4,backend/runs/2025-10-21_3pages_headless_click/
Google Phone Now $0?,Order New Phone 5g ($0 Google Pixel Pro Fold) | Order New Phone and Plan ($0 New Smartphone) | Order $0 New Phone 5g (Google Pixel Pro Fold) | Order New Smartphone 5g ($0 Google Pixel Pro Fold) | Order New Smartphone and Plan ($0 New Phone),6,backend/runs/2025-10-21_3pages_headless_click/
Viviendas para Adultos Mayores Desde $499/mes 🏡 🏡 Descubre comunidades para mayores de 55 años desde solo $499 al mes—comodidad asequible sin compromisos.,$499/mo 55 and Older Apartments Near Me | $499/mo Senior Living | $499/mo 55 and Older Apartments in [city] | $499/mo 55 and Older Apartments in [region] | $499/mo 55  Apartments,3,backend/runs/2025-10-21_3pages_headless_click/
Seniors: Get $10/Mo Internet 💸 Internet for $10?,$10 Internet Providers in My Zip Code | find $10 Internet Providers in My Zip Code | see $10 Internet Providers in My Zip Code | $10 Internet Provider in My Zip Code | get $10 Internet Providers in My Zip Code,16,backend/runs/2025-10-21_3pages_headless_click/
Senior Living From $499/Month 🏡 🏡 Discover 55+ senior living communities starting at just $499/month—affordable comfort without compromise.,$499/mo 55 and Older Apartments Near Me | $499/mo Senior Living | $499/mo 55 and Older Apartments in [city] | $499/mo 55 and Older Apartments in [region] | $499/mo 55  Apartments,5,backend/runs/2025-10-21_3pages_headless_click/
Drive your new truck with zero down Drive your dream truck today!,100 accepted 0 down options new f150 and ram trucks near me [at no cost] apply now | find 100 accepted 0 down options new f150 and ram trucks near me [at no cost] apply now | 100 accepted 0 down options new f150 and ram trucks near me [at no cost] apply now near you | get 100 accepted 0 down options new f150 and ram trucks near me [at no cost] apply now | apply for 100 accepted 0 down options new f150 and ram trucks near me [at no cost] apply now,2,backend/runs/2025-10-21_3pages_headless_click/
¡Solo $249 al mes por vivienda para mayores!,best senior living options for $249/mo | senior living options for $249/mo | find senior living options for $249/mo | best senior living options for $249/month | senior living options for $249/month,14,backend/runs/2025-10-21_3pages_headless_click/
Juvederm treatments at surprisingly low prices Smooth out wrinkles and restore volume — Juvederm treatments are more affordable than ever.,juvéderm clinics near me | find juvéderm clinics near me | see juvéderm clinics near me | must-see juvéderm clinics near me | must see juvéderm clinics near me,3,backend/runs/2025-10-21_3pages_headless_click/
Get paid to learn — start driving today Get paid while you train!,pickup driver career | find pickup driver career | pickup driver career near you | start pickup driver career | apply for pickup driver career,1,backend/runs/2025-10-21_3pages_headless_click/
Take back your independence today Regain your freedom with a Medicare-covered mobility scooter — no out-of-pocket costs for those who qualify.,applying for medicare-covered mobility scooters asap - 100 coverage | apply for medicare-covered mobility scooters asap - 100 coverage | find applying for medicare-covered mobility scooters asap - 100 coverage | applying for medicare-covered mobility scooters asap - 100 coverage near you | get applying for medicare-covered mobility scooters asap - 100 coverage,3,backend/runs/2025-10-21_3pages_headless_click/
Grand Cherokee From $100/Month Don’t miss this: Grand Cherokee SUV deals starting at just $100/month—available now in your area.,$100/month ‐ Grand Cherokee 2024 Suvs Nearby | $100/month Grand Cherokee 2024 Suvs Nearby | $100/month ‐ Grand Cherokee 2024 Suvs Near me | $100/month ‐ Grand Cherokee 2024 Suv Nearby | $100/month ‐ Grand Cherokee 2025 Suvs Nearby,14,backend/runs/2025-10-21_3pages_headless_click/
Medications Linked to Atrial Fibrillation 💊 New research reveals medications linked to atrial fibrillation—see which drugs could increase your risk.,paroxysmal atrial fibrillation anticoagulation | atrial fibrillation medications | anticoagulation in elderly patients with atrial fibrillation | symptoms of atrial fibrillation in elderly | early detection of atrial fibrillation,2,backend/runs/2025-10-21_3pages_headless_click/
Talk to a Local Immigration Lawyer 🌎 Need immigration assistance?,Immigration attorneys in Los Angeles | Immigration attorney in California | Find an immigration lawyer | Get an immigration lawyer quickly | Find immigration lawyer in my area,3,backend/runs/2025-10-21_3pages_headless_click/
Internet desde $19 ¡Tu código postal califica!,$19.99 Internet Providers in My Zip Code | see $19.99 Internet Providers in My Zip Code | find $19.99 Internet Providers in My Zip Code | $19.99 Internet Provider in My Zip Code | get $19.99 Internet Providers in My Zip Code,11,backend/runs/2025-10-21_3pages_headless_click/
Instant Rogue Approval Want a Nissan Rogue?,nearby rogue - zero down 100 accepted suvs | find nearby rogue - zero down 100 accepted suvs | get nearby rogue - zero down 100 accepted suvs | see nearby rogue - zero down 100 accepted suvs | nearby rogue - zero down 100 accepted suv,15,backend/runs/2025-10-21_3pages_headless_click/
Tree Removal for Just $49 – See If You Qualify!,Tree Cutting Service for $49 Near My Zipcode | Tree Cutting Services for $49 Near My Zipcode | Tree Cutting Service Near My Zipcode for $49 | Tree Cutting Services Near My Zipcode for $49 | Tree Cutting Service for $49 Near Me,40,backend/runs/2025-10-21_3pages_headless_click/
Ram 2024 por $100/Mes La Dodge Ram 2024 está aquí por solo $100 al mes.,$100/month - Dodge Ram 2024 Nearby | $100/month - Dodge Ram 2024 Near Me | $100/month Dodge Ram 2024 Nearby | See $100/month - Dodge Ram 2024 Nearby | Find $100/month - Dodge Ram 2024 Nearby,3,backend/runs/2025-10-21_3pages_headless_click/
"$99 Laser Skin Rejuvenation Get fresh, rejuvenated skin with laser treatments.",Laser skin rejuvenation [city] | Laser skin rejuvenation in [city] | Facial Laser Rejuvenation Treatment | Face Rejuvenation Laser Treatment | Facial Laser Treatment,27,backend/runs/2025-10-21_3pages_headless_click/
$99 Laser Skin Rejuvenation Rejuvenate Your Skin!,Laser skin rejuvenation [city] | Laser skin rejuvenation in [city] | Facial Laser Rejuvenation Treatment | Face Rejuvenation Laser Treatment | Facial Laser Treatment,1,backend/runs/2025-10-21_3pages_headless_click/
"Budget-Friendly 55+ Apartments Revealed Discover hidden affordable apartment options designed for those 55+, with benefits you might not expect.",55 and older apartments near me | see 55 and older apartments near me | find 55 and older apartments near me | 55 and older apartment near me | discover 55 and older apartments near me,14,backend/runs/2025-10-21_3pages_headless_click/
Comidas Gratis a Domicilio para Adultos Mayores 🥗 Los adultos mayores pueden calificar para recibir comidas nutritivas gratis directamente en su puerta—descubre hoy si tú o un ser,home delivered meals for seniors no cost | $0 meal delivery | free home delivered meals for seniors near me | free home delivered meals for seniors | $0 meal delivery in [city],4,backend/runs/2025-10-21_3pages_headless_click/
Dinero Gratis Para Baños Desbloquea subvenciones secretas para renovar tu elegibilidad de verificación de baño ahora.,bathroom remodel paid by grants [region] | bathroom remodel paid by grants  | get bathroom remodel paid by grants  | find bathroom remodel paid by grants  | bathroom remodel paid for by grants ,7,backend/runs/2025-10-21_3pages_headless_click/
{{product.,Laser skin rejuvenation [city] | Laser skin rejuvenation in [city] | Facial Laser Rejuvenation Treatment | Face Rejuvenation Laser Treatment | Facial Laser Treatment,2,backend/runs/2025-10-21_3pages_headless_click/
Seniors Under 85 Can Own a GMC Sierra for Less Than $10K!,gmc sierra 1500 clearance sale - see [region] prices | see gmc sierra 1500 clearance sale - see [region] prices | find gmc sierra 1500 clearance sale - see [region] prices | must-see gmc sierra 1500 clearance sale - see [region] prices | must see gmc sierra 1500 clearance sale - see [region]prices,1,backend/runs/2025-10-21_3pages_headless_click/
Senior Living for $249!,best senior living options for $249/mo | senior living options for $249/mo | find senior living options for $249/mo | best senior living options for $249/month | senior living options for $249/month,29,backend/runs/2025-10-21_3pages_headless_click/
Tree Cutting From $9 Near You 🌳 Tree removal starting at just $9—see if your ZIP qualifies today.,$9 tree cutting service (near my zipcode) | find $9 tree cutting service (near my zipcode) | discover $9 tree cutting service (near my zipcode) | $9 tree cutting service near me | $9 tree cutting service nearby,15,backend/runs/2025-10-21_3pages_headless_click/
{{product.,$9 tree cutting service (near my zipcode) | find $9 tree cutting service (near my zipcode) | discover $9 tree cutting service (near my zipcode) | $9 tree cutting service near me | $9 tree cutting service nearby,5,backend/runs/2025-10-21_3pages_headless_click/
Obtén dinero gratis para comprar una casa ¿Necesitas una casa?,Help me get a house | Assist me in getting a house | Help me get a house in {city} | Help me get a house in 2025 | Help me get a house in {region} by 2025,4,backend/runs/2025-10-21_3pages_headless_click/
Seniors: Rent Starts Low Senior apartments for just $499/month?,499/mo 55 and older apartments near me [state] | 499/mo 55 and older apartments nearby | 499/mo 55 and older apartments near me | see 499/mo 55 and older apartments | find 499/mo 55 and older apartments,10,backend/runs/2025-10-21_3pages_headless_click/
"Laser Skin Rejuvenation Without Breaking Bank Get fresh, rejuvenated skin with laser treatments.",Laser skin rejuvenation [city] | Laser skin rejuvenation in [city] | Facial Laser Rejuvenation Treatment | Face Rejuvenation Laser Treatment | Facial Laser Treatment,2,backend/runs/2025-10-21_3pages_headless_click/
"Free Meals for Seniors Delivered 🥗 Seniors may qualify for free, nutritious meals delivered right to their doorstep—see if you or a loved one are eligible today.",home delivered meals for seniors no cost | $0 meal delivery | free home delivered meals for seniors near me | free home delivered meals for seniors | free home delivered meals for seniors in [city],4,backend/runs/2025-10-21_3pages_headless_click/
Internet desde $10 Proveedores de internet desde $10 ya disponibles en tu zona.,$10 Internet Providers in My Zip Code | find $10 Internet Providers in My Zip Code | see $10 Internet Providers in My Zip Code | $10 Internet Provider in My Zip Code | get $10 Internet Providers in My Zip Code,1,backend/runs/2025-10-21_3pages_headless_click/
Get Your Permanent Dental Implants NOW – 100% FREE!,,24,backend/runs/2025-10-21_3pages_headless_click/
👉 Check If You Qualify for Free Fat Removal Today!,,2,backend/runs/2025-10-21_3pages_headless_click/
"$4,000 for Doing Almost Nothing – Sleep Apnea Trial Paying NOW!",,7,backend/runs/2025-10-21_3pages_headless_click/
Affordable Botox Treatments Smooth your look without overspending.,,3,backend/runs/2025-10-21_3pages_headless_click/
"Earn $1,500 + FREE Treatment—Join This Study TODAY!",,2,backend/runs/2025-10-21_3pages_headless_click/
💉 Botox From $3/Unit – Limited-Time Offer!,,5,backend/runs/2025-10-21_3pages_headless_click/
💥 FREE Dental Implants + Cash — See If You Qualify NOW!,,6,backend/runs/2025-10-21_3pages_headless_click/
Compra tu Casa con Dinero Gratis: Descubre Cómo ¿Quieres comprar una casa pero no tienes dinero?,Help me get a house | Assist me in getting a house | Help me get a house in {city} | Help me get a house in 2025 | Help me get a house in {region} by 2025,4,backend/runs/2025-10-21_3pages_retry/
$249/Month Senior Living!,Senior Living Options for $249/month | see Senior Living Options for $249/month | find Senior Living Options for $249/month | must see Senior Living Options for $249/month | must-see Senior Living Options for $249/month,3,backend/runs/2025-10-21_3pages_retry/
Tree Removal for Just $49 – See If You Qualify!,tree cutting service for $49 near my zipcode | tree cutting services for $49 near my zipcode | tree cutting service near my zipcode for $49 | tree cutting services near my zipcode for $49 | tree cutting service for $49 near me,3,backend/runs/2025-10-21_3pages_retry/
Botox completo solo $119 Luce radiante con Botox completo por solo $119—la belleza gana aquí everydaysolutions.,get $119 botox doctor near me full botox | $119 botox doctor near me full botox | get $119 botox doctor nearby full botox | Get $119 Botox Doctor Near [city] Full Botox | Get $119 Botox Doctor Near [region] Full Botox,8,backend/runs/2025-10-21_3pages_retry/
Botox completo solo $119 Luce radiante con Botox completo por solo $119—la belleza gana aquí everydaysolutions.,Get $119 Botox Doctor Near Me Full Botox | $119 Botox Doctor Near Me Full Botox | Get $119 Botox Doctor Nearby Full Botox | Get $119 Botox Doctor Near [city] Full Botox | Get $119 Botox Doctor Near [region] Full Botox,8,backend/runs/2025-10-21_3pages_retry/
Teléfonos Gratis para Adultos Mayores Celulares económicos y fáciles de usar esperan por los adultos mayores.,discounted senior phone plans | get discounted senior phone plans | discounted phones for seniors 60 and older | discounted phones for seniors 60 | best discounted senior phone plans,8,backend/runs/2025-10-21_3pages_retry/
